DOI	Title	Authors	Abstract	Journal	Date
10.1371/journal.pmed.1004722	association lower fasting plasma glucose level oral glucose tolerance test adverse perinatal outcome chinese cohort study	Wang L; Tang C; Cheng M; Hao Y; Chen S; Zhang S; Zhang C; Mol BW; Wu Y; Huang H	background is unknown fasting plasma glucose fpg level normal range defined international association diabetes pregnancy study group iadpsg criterion is associated perinatal outcome study explored association fpg level lower iadpsg threshold oral glucose tolerance test ogtt adverse perinatal outcome woman gestational diabetes mellitus gdm method finding january to may retrospective cohort study included woman singleton pregnancy obstetrics gynecology hospital fudan university shanghai china woman underwent ogtt gestational week primary endpoint wa composite adverse outcome including gestational hypertension preeclampsia fetal death stillbirth preterm birth primary cesarean delivery small large gestational age overall woman had gdm whom had fpg level iadpsg threshold compared to gdm population woman fpg level were significantly greater risk adverse outcome adjusted odds ratio aor ci aor ci aor ci glucose level nonetheless woman demonstrated significantly lower risk aor ci compared to gdm counterpart exhibiting low fasting glycemia however study wa limited retrospective design may lack generalizability to other ethnic group conclusion even fpg level lower iadpsg threshold fpg wa significantly associated adverse perinatal outcome association presented different pattern woman gdm	PLoS Med	01/09/2025
10.1056/NEJMoa2504650	aspirin localized colorectal cancer	Martling A; Hed Myrberg I; Nilbert M; Grönberg H; Granath F; Eklund M; Öresland T; Iversen LH; Haapamäki C; Janson M; Westberg K; Segelman J; Ersson U; Prytz M; Angenete E; Bergström R; Mayrhofer M; Glimelius B; Lindberg J	background aspirin reduces incidence colorectal adenoma colorectal cancer person observational study suggest aspirin may also improve survival diagnosis particularly patient tumor harboring somatic mutation however data randomized trial are lacking method conducted randomized trial involving patient stage ii iii rectal cancer stage ii iii colon cancer somatic alteration pathway gene patient were assigned ratio to receive mg aspirin matched placebo once daily year patient prespecified hotspot mutation exon group alteration other somatic variant pten group alteration were eligible randomization primary end point wa colorectal cancer recurrence assessed analysis patient group alteration secondary end point included colorectal cancer recurrence patient group alteration survival safety result alteration pathway gene were detected patient complete genomic data patient group alteration patient group alteration respectively were assigned to receive aspirin placebo estimated cumulative incidence recurrence wa aspirin placebo hazard ratio confidence interval ci to patient group alteration respectively hazard ratio ci to group alteration estimated survival wa aspirin placebo hazard ratio ci to patient group alteration respectively hazard ratio ci to group alteration severe adverse event occurred aspirin recipient placebo recipient conclusion aspirin led to significantly lower incidence colorectal cancer recurrence placebo patient hotspot mutation exon appeared to have similar benefit other somatic alteration pathway gene funded swedish research council others alascca number eudract number	N Engl J Med	18/09/2025
10.1158/2159-8290.CD-25-0323	development prospective validation model early detection pancreatic cancer	Wang X; Wang H; Zhang M; Li H; Liu Y; Huang H; Pei J; Huang J; Zang F; Zhang Y; Chen X; Gao S; Zhao T; Wang J; Ma W; Liang Y; Shi S; Li S; Li W; Zhou T; Zhang Y; Cui X; Ye ZX; Sun Y; Peng L; Hu X; Li Z; Zhang H; Zhu D; Chang S; Zhang J; Yang R; Bao H; Wu X; Shao Y; Yu J; Gao C; Cui Y; Hao J	pancreatic cancer pc remains highly lethal malignancy due to diagnosis limited therapeutic option study present development validation circulating dna cfdna model early pc detection study comprising pc patient healthy control model demonstrated high diagnostic accuracy training validation prospective cohort study involving individual diabetes obesity established risk factor pc further assessed clinical applicability model detected pc case including stage patient lead time to day significantly outperforming additionally demonstrates potential distinguishing pancreatic cyst thereby facilitating more precise risk stratification study highlight potential screening scalable tool early pc detection warranting further clinical validation to enhance patient outcome	Cancer Discov	22/09/2025
10.1038/s41593-025-02056-4	septal inhibitory circuit mediates anticipatory control drinking	Xu L; Sun Y; Huang C; Zheng Y; Chen J; Ma X; Shi Q; Liu M; Qiu X; Zhao Q; Gao C; Liao J; Wang Y; Chen Z	drinking behavior is not only homeostatically regulated also rapidly adjusted change blood osmolality occur known anticipatory thirst satiation homeostatic anticipatory signal converge subfornical organ sfo however neural pathway conveying peripheral information to sfo change blood composition are incompletely understood here reveal inhibitory pathway medial septum m to sfo that is involved control anticipatory drinking behavior mouse m acid gaba ergic neuron encode signal integrating cue oral cavity tracking gastrointestinal signal neuron receive input parabrachial nucleus relay to sfo camkii neuron forming pathway activity prevents overhydration disruption circuit lead to excessive water intake hyponatremia finding reveal septal pathway that integrates multiple layer presystemic signal to drinking behavior	Nat Neurosci	22/09/2025
10.1038/s42255-025-01365-z	neurolipid atlas lipidomics resource neurodegenerative disease	Feringa FM; Koppes-den Hertog SJ; Wang LY; Derks RJE; Kruijff I; Erlebach L; Heijneman J; Miramontes R; Pömpner N; Blomberg N; Olivier-Jimenez D; Johansen LE; Cammack AJ; Giblin A; Toomey CE; Rose IVL; Yuan H; Ward ME; Isaacs AM; Kampmann M; Kronenberg-Versteeg D; Lashley T; Thompson LM; Ori A; Mohammed Y; Giera M; van der Kant R	lipid alteration brain have been implicated many neurodegenerative disease to facilitate comparative lipidomic research brain disease establish data common named neurolipid atlas prepopulated isogenic induced pluripotent stem cell ip cell lipidomics data different brain disease additionally resource contains lipidomics data human mouse brain tissue leveraging multiple datasets demonstrate ip neuron microglia astrocyte exhibit distinct lipid profile that recapitulate vivo lipotypes notably alzheimer disease ad risk gene drive cholesterol ester ce accumulation specifically human astrocyte also observe ce accumulation lipidomics person ad multiomics interrogation ip astrocyte revealed altered cholesterol metabolism ha major role astrocyte immune pathway such immunoproteasome major histocompatibility complex class antigen presentation data common available online http allows data deposition community provides tool knowledge base better understanding lipid dyshomeostasis neurodegenerative disease	Nat Metab	22/09/2025
10.1038/s42255-025-01360-4	consensus guide to preclinical indirect calorimetry experiment	Banks AS; Allison DB; Alquier T; Ansarullah; Austad SN; Auwerx J; Ayala JE; Baur JA; Carobbio S; Churchill GA; Dall M; de Cabo R; Donato J Jr; Dragano NRV; Elias CF; Ferrante AW Jr; Finck BN; Galgani JE; Gerhart-Hines Z; Goodyear LJ; Grobe JL; Gupta RK; Habegger KM; Hartig SM; Hevener AL; Heymsfield SB; Holman CD; de Angelis MH; James DE; Kazak L; Kim JB; Klingenspor M; Kong X; Kooijman S; Lantier L; Lloyd KCK; Lo JC; Lodhi IJ; MacLean PS; McGuinness OP; Medina-Gómez G; Mirmira RG; Morrison CD; Morton GJ; Müller TD; Ogawa Y; Pajuelo-Reguera D; Potthoff MJ; Qi N; Reitman ML; Rensen PCN; Rozman J; Rutkowsky JM; Sakamoto K; Scherer PE; Schwartz GJ; Sedlacek R; Selloum M; Shaikh SR; Chen S; Shulman GI; Škop V; Soukas AA; Speakman JR; Spiegelman BM; Steinberg GR; Svensson KJ; Thyfault JP; Tiganis T; Titchenell PM; Turner N; Velloso LA; Vidal-Puig A; Ward CS; Williams AS; Wolfrum C; Xu AW; Xu Y; Zierath JR	understanding complex factor influencing mammalian metabolism body weight homeostasis is challenge requiring knowledge energy intake absorption expenditure using measurement respiratory gas exchange indirect calorimetry can provide estimate energy expenditure however inconsistent measurement unit flawed data normalization method have slowed progress field guide aim to establish consensus standard to unify indirect calorimetry experiment analysis more consistent meaningful reproducible result establishing standard hope to facilitate data comparison research datasets advance will allow creation data repository built shared standard overdue initiative stand to markedly improve accuracy depth effort to interrogate mammalian metabolism data sharing according to established best practice will also accelerate translation basic finding clinical application metabolic disease afflicting global population	Nat Metab	01/09/2025
10.1038/s41392-025-02399-1	conjugate promising cancer therapy comprehensive evaluation rodent to primate	Su M; Liu Y; Lin H; Wang X; Ying D; Zhang L; Yang C; Jiang M; Xu L; Wang X; Sun Y; Xu H; Zhang Z; Wang X; Fu T; Xie S; He J; Liu X; Tan W	aptamers serve unique targeting ligand making conjugate apdcs attractive strategy targeted cancer therapy study performs comprehensive evaluation rodent to primate nhp protein tyrosine kinase apdc made conjugating potent antimitotic agent monomethyl auristatin mmae to classic aptamer efficacy study various cancer type overexpression showed effectively induces sustained tumor regression cell xenograft outperforming unconjugated mmae chemotherapy drug paclitaxel conjugate pharmacokinetic pk study mouse revealed lead to rapid accumulation sustained mmae level tumor fast clearance plasma normal tissue further study rat confirmed rapid clearance most organ revealed mmae wa excreted urine feces toxicokinetic tk assessment indicated comparable systemic drug exposure accumulation repeated dos compared to single administration toxicity evaluation showed therapeutic dose high efficacy wa safe toxicity resulting extremely high dos could be reversibly controlled encouraged finding evaluated profile safety cynomolgus monkey similar to profile observed rat demonstrated good drug exposure wa moreover well tolerated monkey obvious accumulation following multiple administration finding highlight potential effective antitumor agent provide useful insight clinical translation emerging apdcs	Signal Transduct Target Ther	24/09/2025
10.1073/pnas.2514948122	is negative regulator sting signaling cancer cell inhibition reactivates immune surveillance cold tumor	Chowdhury SR; Parikh CN; Kaur AN; DeMarco KD; Giwa HK; Mishra AK; Murphy KC; Zhou L; Ma B; Ye T; Li J; Liu H; Bai S; Johnson C; Simin K; Pitarresi JR; Zhu LJ; Watson EV; Kelliher MA; Green MR; Fitzgerald KA; Ruscetti M	immunotherapy modality have revolutionized cancer treatment number metastatic tumor type still many malignancy that lack cell infiltration are termed immunologically quot cold quot fail to respond to modality one approach to increase tumor immunogenicity ha been to induce stimulator interferon gene sting downstream interferon signaling that is often dysregulated cold tumor early success sting agonist preclinical cancer model approach have not been successful clinic due to poor tumor penetrance systemic toxicity here performed crispr screen to uncover therapeutic target to activate sting expression human tumor identified lysosomal hydrolase palmitoyl protein negative regulator sting highly expressed cold ovarian prostate tumor genetic pharmacological suppression increased sting protein stability downstream activation interferon inflammatory cytokine signaling to enhance cell migration treatment preclinical prostate ovarian cancer model expressing low level sting small molecule inhibitor enhanced sting expression activation leading to infiltration activation cytotoxic cell that turned tumor quot hot quot reduced tumor growth fibrosis dissemination toxicity further analysis demonstrated is associated reduced sting expression cell number overall survival immunotherapy outcome ovarian prostate cancer patient thus inhibition may be promising approach to activate sting potentiate effect immunotherapy cold tumor	Proc Natl Acad Sci U S A	30/09/2025
10.1093/eurheartj/ehaf763	axis pulmonary arterial hypertension therapeutic implication	Xu H; Ye L; Du C; Tang H; Zheng Q; Zhu C; Liang B; Wang Y; Mao X; Liang Q; Zhang J; Shao H; Sun X; Yuan R; Yun W; Luo C; Xiu J; Su W; Fan F; Dai Z; Chen L; Guan Y; Zhang X	background aim pulmonary arterial hypertension pah is progressive condition marked abnormal proliferation pulmonary artery smooth muscle cell pasmcs leading to significant remodelling pulmonary artery pa cyclooxygenase metabolite arachidonic acid prostaglandin receptor are crucial maintaining vascular homeostasis study aimed to determine role pathogenesis pah evaluate potential therapeutic target pah method two pah model rat model mouse model were used study pharmacological intervention including antagonist grapiprant agonist genetic strategy including vascular smooth muscle cell vsmc knockout mouse human transgenic mouse were used to comprehensively investigate role pathogenesis pah multiple cellular molecular biology approach were employed to investigate underlying mechanism result result showed pharmacological blockade receptor genetic deletion gene vsmcs led to significant improvement pah pa remodelling conversely pharmacological activation overexpression exacerbate pah progression further analysis identified annexin critical downstream mediator pah progression mechanistically activation wa found to enhance translation phosphorylation pathway promoting pasmc proliferation migration increased nuclear translocation key signalling molecule canonical wnt pathway importantly pharmacological inhibition genetic deletion effectively protected pah rodent suggesting pathogenic role pah development conclusion study reveals crucial pathway involving pah development progression targeting downstream effector represents promising therapeutic strategy pah management	Eur Heart J	25/09/2025
10.1111/epi.17410	drug resistance idiopathic generalized epilepsy evidence concept	Gesche J; Beier CP	approximately patient idiopathic generalized epilepsy ige generalized epilepsy remain there is consensus established concept regarding underlying mechanism prevalence review summarizes recent data current hypothesis mechanism that may contribute to ige literature search wa conducted pubmed embase study mechanism drug resistance published literature show consensus definition widely accepted model to explain drug resistance ige one subsyndromes genetic study have failed to identify distinct genetic cause affected gene involved pharmacokinetics found clinical experimental evidence support four hypothesis quot network hypothesis quot degree drug resistance ige reflects severity cortical network alteration quot minor focal lesion predisposed brain hypothesis quot cortical lesion are important drug resistance quot hypothesis quot functioning acidergic interneurons contributes to drug resistance quot change drug kinetics quot impaired kinetics antiseizure medication asm reduce effectiveness available asms summary exact definition cause drug resistance ige is unknown however published evidence suggests four different mechanism that may warrant further investigation	Epilepsia	01/12/2022
10.1186/s12933-025-02826-1	association index mortality patient different glucose metabolism status	Liu J; Kang J; Liang P; Song Z; Li G; Jin X; Wu H	objective index tyg is emerging marker metabolic health association mortality different glucose metabolism status remains unclear study aimed to investigate relationship tyg risk cardiovascular mortality individual normoglycemia dysglycemia diabetes mellitus method participant nine cycle national health nutrition examination survey nhanes were included categorized three group normoglycemia dysglycemia diabetes cox regression restricted cubic spline rcs analysis were performed to evaluate linear nonlinear association tyg mortality to assess predictive power tyg atherogenic index plasma aip mortality receiver operating characteristic roc curve were constructed subgroup analysis were conducted based age sex blood pressure status result median year total death cardiovascular death were documented normoglycemic group single standard unit increase tyg wa associated higher risk mortality higher risk cardiovascular mortality hr ci hr ci respectively participant diabetes rcs analysis revealed association tyg mortality inflection point significant association were observed dysglycemia group tyg demonstrated superior predictive performance compared to aip mortality normoglycemic diabetic individual subgroup analysis identified significant interaction effect age sex association tyg mortality conclusion tyg wa associated increased risk cardiovascular death normoglycemic subgroup not dysglycemic subgroup diabetes subgroup association tyg mortality wa nonlinear predictive value tyg different glucose metabolism status provides new evidence medical practice	Cardiovasc Diabetol	24/09/2025
10.1111/jdv.70067	effectiveness safety baricitinib severe alopecia areata result	Piraccini BM; Cedirian S; Pampaloni F; Rapparini L; Quadrelli F; Bruni F; Ala L; Acri MC; Rossi A; Pellacani G; Lacarrubba F; Dall&#x27;Oglio F; Micali G; Foggia L; Cantelli M; Nappa P; Diluvio L; Bianchi L; Luigi N; Bolzon A; Peris K; Caldarola G; Girolomoni G; Marangoni F; Bellinato F; Gisondi P; Silvi G; Prignano F; Pimpinelli N; Tomasini C; Barruscotti S; Simonetti O; de Simoni E; Ambrogio F; Foti C; Boccaletti V; Fraghì A; Marzano AV; Mattioli MA; Ferrucci S; Sechi A; Valtellini L; Barbareschi M; Gallo G; Ribero S; Quaglino P; Di Corteranzo IG; Balestri R; Pagliarello C; Caposiena RD; Zalaudek I; Vagnozzi E; Fargnoli MC; Caponio C; Rubegni P; Cinotti E; Trovato E; Romanelli M; Dini V; Manzo Margiotta F; Feliciani C; De Felici Del Giudice MB; Atzori L; Sanna S; Lembo S; Raimondo A; Magnano M; Argenziano G; Babino G; Fulgione E; Rongioletti F; Pesce N; Guida S; Guglielmo A; Schettini N; Starace M	background alopecia areata aa is autoimmune condition leading to hair loss baricitinib janus kinase jak inhibitor ha demonstrated efficacy controlled clinical trial data effectiveness safety remain limited objective study aimed to assess effectiveness safety baricitinib mg daily italian adult patient severe aa treatment period method conducted retrospective observational multicenter study italian university hospital adult patient year severe aa severity alopecia tool salt score who initiated baricitinib mg daily treatment november october were included effectiveness wa measured percentage patient achieving salt week secondary outcome included change mean salt score trichoscopic finding quality life hospital anxiety depression scale hads outcome clinro eyebrow eyelash adverse event were also documented result total patient female mean age year were included week achieved salt achieved salt mean salt score significantly decreased baseline to week lt trichoscopic assessment showed decline yellow dot black dot dystrophic hair whilst regrowing hair increased score improved significantly to lt did hads anxiety to lt hads depression to lt adverse event were reported patient conclusion study confirms effectiveness baricitinib achieving significant hair regrowth improving psychological severe aa patient	J Eur Acad Dermatol Venereol	23/09/2025
10.1186/s13102-021-00259-3	influence athletic performance highest position final ranking serie season	Longo UG; Sofi F; Candela V; Risi Ambrogioni L; Pagliai G; Massaroni C; Schena E; Cimmino M; D&#x27;Ancona F; Denaro V	background previous study serie season showed greater likelihood reaching top position italian league quot quot seemed to be mainly related to sprint activity goal attempt total throw target shot assist therefore aim to evaluate following season data same league to compare confirm improve result method data all match played quot quot season were obtained italian soccer league team analysis wa performed term total distance covered km jogging running sprint activity average speed match statistic total shot shot target goal attempt assist turnover steal result team that reached first four position revealed lower percentage running lt higher percentage jogging sprint activity lt match statistic seem to be statistically different first four team other team total goal are strongly associated total score end championship lt position final ranking lt conclusion result suggest team have lower running rate higher percentage jogging sprinting other team	BMC Sports Sci Med Rehabil	25/03/2021
10.3390/biom14040437	role epigenetics glial cell autism spectrum disorder	Csoka AB; El Kouhen N; Bennani S; Getachew B; Aschner M; Tizabi Y	autism spectrum disorder asd is neurodevelopmental disorder characterized severe deficit social communication interaction repetitive movement abnormal focusing object activity that can significantly affect quality life afflicted neuronal glial cell have been implicated ha genetic component can also be triggered environmental factor drug example prenatal exposure to valproic acid acetaminophen ingestion propionic acid can increase risk asd recently epigenetic influence asd have come to forefront investigation etiology prevention treatment disorder epigenetics refers to dna modification alter gene expression making change to dna sequence increasing number pharmaceutical environmental chemical are being implicated etiology asd here specifically focus molecular influence abovementioned chemical epigenetic alteration neuronal glial cell potential connection to asd conclude better understanding phenomenon can lead to more effective intervention asd	Biomolecules	03/04/2024
10.1038/s41467-025-64035-4	macrophage ferroptosis potentiates deficiency induced pulmonary venous arterialization	Zhang J; Mao P; Zhou T; Yue B; Li Y; Qiu Y; Ying K; Wang F; Chen J; Yang J	pulmonary disease pvod is fatal disease characterized remodelling pulmonary vein haemosiderin accumulation macrophage general control nonderepressible deficiency ha been reported pvod patient underlying mechanism which deficiency affect pulmonary venous cell surrounding cell remains unclear here perform immunohistochemistry analysis to show macrophage are major population affected deficiency ferroptosis gene are upregulated lung macrophage pvod patient treatment specific ferroptosis inhibitor revers change haemodynamic index observed hypoxia mouse pvod model rat furthermore deficiency increase iron level to facilitate ferroptosis macrophage enhances arterial marker expression venous endothelial cell vecs specifically spatial transcriptome analysis show increased expression kdr vecs pvod patient finding suggest potential targeting macrophage ferroptosis therapeutic strategy treating related vascular disease using expression specific marker set venous arterialization	Nat Commun	22/09/2025
10.4088/JCP.16f10721	use acetaminophen paracetamol pregnancy risk disorder offspring	Andrade C	prenatal exposure to acetaminophen may result compromised neurodevelopment inflammatory immunologic mechanism predisposition to oxidative stress endocrine endogenous cannabinoid other mechanism several small large prospective study have found association gestational acetaminophen exposure disorder adhd behavior use adhd medication adhd diagnosis offspring childhood only negative study wa small investigation that examined only one aspect attention outcome creditably most study adjusted analysis many not confounds associated adhd risk importantly one pivotal study also adjusted pain infection inflammation fever to reduce confounding indication study found risk light finding single study infection fever pregnancy do not raise adhd risk appears possible use acetaminophen pregnancy is responsible increased risk adhd suggests acetaminophen may not be safe pregnancy is widely believed however fever pregnancy may be associated adverse gestational outcome given present level uncertainty adhd risk acetaminophen is suggested more data are available use acetaminophen pregnancy should not be denied situation which need drug is clear	J Clin Psychiatry	01/03/2016
10.1038/s41564-025-02119-z	metagenomics reveals microbiome diversity tick specie	Du LF; Shi W; Cui XM; Fan H; Jiang JF; Bian C; Ye RZ; Wang Q; Zhang MZ; Yuan TT; Xia LY; Ruan XD; Chang QC; Du CH; Que TC; Wang X; Han XH; Yang TC; Jiang BG; Chen JY; Wang XR; Tan LF; Liu YW; Deng LL; Liu Y; Zhu Y; Pan YS; Wang N; Lin ZT; Li LF; Li C; Shen SJ; Liu YT; Tian D; Han XY; Wang J; Wang YF; Gao WY; Li YY; Xiong T; Wang TH; Shi XY; Zhu DY; Zhu JG; Wang CC; Shi WQ; Zhan L; Liu ZH; Feng D; Zhao L; Sun Y; Wang J; Jia N; Zhao F; Cao WC	tick are arthropod vector capable transmitting wide spectrum pathogen affecting human animal however have relatively limited information genomic characteristic diversity associated microbiomes here used sequencing sample tick specie eight genus china to determine genome associated pathogen microbiome novo assembly reconstructed bacterial genome representing bacterial specie which genome represented potentially pathogenic specie computational analysis found nutritional endosymbionts to be prevalent highly specific to tick genus microbiome association study revealed host genetic variant linked to pathogen diversity abundance key biological pathway essential to tick biology including pathogen invasion finding provide resource studying interaction tick paving way strategy to control tick population disease	Nat Microbiol	23/09/2025
