DOI	Title	Authors	Abstract	Journal	Date
10.1097/JS9.0000000000003552	deciphering pathogenic mechanism bdcpp exposure endometrial cancer progression integrated approach combining network toxicology machine learning molecular docking	Wang Z; Fu Y; Cai Q; Zong L	background endometrial cancer ec is one most common gynecological malignancy globally increasing attention ha been paid to role environmental pollutant ec development epidemiological study have demonstrated significant association elevated urinary concentration bi phosphate bdcpp increased risk ec however hub gene underlying mechanism ec remain poorly understood material method potential target bdcpp ec were retrieved multiple database interaction ppi network wa constructed based common target enrichment analysis wa performed using go kegg reactome database clinical transcriptomic data ec patient were downloaded tcga subsequently machine learning model were employed to screen hub gene risk score bdcpp exposure wa calculated based hub gene gene set enrichment analysis gsea wa conducted hub gene molecular docking wa performed to predict binding affinity bdcpp to hub gene result identified potential target implicated ec machine learning pinpointed eight hub gene plau thrb bdcpp exposure risk score model offer framework predicting prognosis ec patient moderate accuracy molecular docking revealed binding potential bdcpp hub gene finding highlight pivotal role inflammatory activation hormonal disruption altered lipid metabolism epigenetic dysregulation pathogenic mechanism gsea further emphasized critical role nucleocytoplasmic transport polycomb repressive complex mrna surveillance pathway process conclusion study investigated hub gene underlying mechanism ec finding not only offer novel insight role environmental pollutant ec development also present analytical framework elucidating carcinogenic mechanism other environmental chemical	Int J Surg	24/09/2025
10.1080/09546634.2025.2555210	spesolimab child generalized pustular psoriasis accompanied epilepsy hyperactivity	Wang Y; Qin J; Peng L; He L; Yang B; Yang M; Feng Y	objective to evaluate therapeutic efficacy safety spesolimab pediatric gpp treatment method report male pediatric patient refractory generalized pustular psoriasis gpp comorbid epilepsy hyperactivity hypoproteinaemia coexistence gt homozygous mutation gt heterozygous variation may have worsened disease phenotype result spesolimab treatment achieved complete rapid response pustule erythema scale cleared week conclusion spesolimab is effective treating pediatric gpp patient is potential to be clinical treatment strategy pediatric gpp future	J Dermatolog Treat	01/12/2025
10.1002/advs.202506345	suppresses atherosclerosis promoting polarization macrophage glycogen metabolic reprogramming	Shen L; Yu J; Chen W; Bi Y; Yang Z; Lu C; Jiang C; Yang Y; Chen M; Zou J; Lv L; Chen X; Ji J	identifying target that promote macrophage polarization hypoxic plaque microenvironment is crucial modulating immune metabolism optimizing energy dynamic atherosclerotic cardiovascular disease ascvd treatment high phagocytic activity macrophage reduces foam cell formation secretion cytokine enhances plaque stability mitigating atherosclerosis progression sequencing bioinformatics analysis protein phosphatase regulatory subunit is identified key regulator linking glycogen metabolism to macrophage polarization integrated approach combined transcriptomic analysis human atherosclerotic plaque macrophage revealing dual role induces macrophage polarization maintains energy supply plaque absence accelerates plaque progression regulates macrophage polarization energy metabolism phosphorylated which play dual role activating transcriptional program axis nucleus enhancing metabolic activity axis mitochondrion play dual role metabolic regulation macrophage phenotype modulation orchestrating glycogen metabolic reprogramming polarization present novel strategy drug development significant potential clinical translation	Adv Sci (Weinh)	23/09/2025
10.3389/fimmu.2025.1620768	increased risk antiphospholipid syndrome patient psoriasis retrospective cohort study	Wang Q; Cui R; Du Y; Wang YH; Wei JC; Dai SM	objective psoriasis is associated systemic inflammation immune dysregulation raising concern potential link to antiphospholipid syndrome aps however evidence risk aps psoriasis patient remains limited material method retrospective cohort study utilized data trinetx collaborative network propensity score matching wa performed to balance demographic variable comorbidities medication use psoriasis patient univariate cox proportional hazard model subgroup analysis were used to estimate hazard ratio aps method wa used to plot cumulative incidence curve result matching cohort included patient psoriasis patient exhibited significantly higher aps incidence case control hr ci psoriatic arthritis psa further amplified risk hr ci subgroup analysis identified elevated aps susceptibility older adult female american individual chronic comorbidities conclusion psoriasis psoriatic arthritis are significant risk factor aps highlighting need targeted screening management strategy population	Front Immunol	01/01/2025
10.1093/cvr/cvaf159	oxidized mediates cholesterol transport dysfunction inflammasome activation to drive aortic valve calcification	Jiang C; Yao D; Shen Q; Tian R; Fan L; Zheng Q; Qian X; Liu Z; Huang Y; Dong N	aim calcific aortic valve disease cavd is becoming more prevalent population ageing however there is currently medical therapy available early lipid deposition lipoprotein ldl mediates chronic inflammation accelerates calcification progression however mechanism still need to be further explored method result study identified transcription factor fox human valvular interstitial cell vics pivotal regulator aortic valve calcification bulk analysis were conducted to establish is induced oxidized ldl oxldl vics to elucidate role osteogenic differentiation small interfering rna recombinant adenovirus were utilized to modulate expression vics diet hfd mouse served vivo model to investigate role aortic valve calcification analysis bulk western blot indicated significant activation oxldl vics silencing inhibiting osteogenic differentiation deletion markedly reduced aortic valve calcification mouse shown decreased calcium deposition aortic valve leaflet chromatin immunoprecipitation sequencing were performed to reveal regulatory mechanism uncovering direct interaction promoter which subsequently inhibits expression axis study demonstrated mediates vics cholesterol transport dysfunction using showed intracellular cholesterol accumulation can activate inflammasome promoting osteogenic differentiation vics additionally wa found recombinant could reduce aortic valve calcification vitro vivo conclusion identified transcription factor inhibits expression axis promotes cholesterol transport dysfunction activation inflammasome vics thereby accelerating progression cavd	Cardiovasc Res	24/09/2025
10.1016/S0140-6736(25)01576-4	oral icotrokinra versus placebo oral deucravacitinib participant plaque psoriasis amp two phase randomised trial	Gold LS; Armstrong AW; Bissonnette R; Magnolo N; Vender RB; Sebastian M; Galimberti ML; Tsianakas A; Arnone M; Wallace P; Simon M; Riera-Monroig J; Gerdes S; Waibel J; Gonzalez-Cantero A; Schwarz B; Tada Y; Cecchini M; Ehst B; Kircik L; Kephart L; Reyes-Servin O; Edem BE; Campbell JH; Shen YK; Cresswell K; Li S; DeKlotz CMC; Nunes F; Papp KA	background monoclonal antibody targeting are efficacious treating plaque psoriasis must be delivered intravenous subcutaneous injection here aimed to evaluate efficacy safety icotrokinra targeted oral peptide that selectively bind receptor compared placebo deucravacitinib adult plaque psoriasis method phase randomised trial which are being done site country site country respectively randomly assigned respectively adult plaque psoriasis diagnosed least week involvement psoriasis area severity index pasi investigator global assessment iga to oral icotrokinra mg placebo deucravacitinib mg participant randomly assigned to placebo deucravacitinib transitioned to icotrokinra week week respectively coprimary endpoint were proportion participant achieving iga clear almost clear skin least improvement least improvement pasi pasi week icotrokinra versus placebo study are registered advance are ongoing finding enrolled participant jan to may enrolled participant march to june participant advance patient screened advance patient screened were randomly assigned to icotrokinra placebo deucravacitinib coprimary endpoint were met trial higher proportion versus participant achieved iga advance v treatment difference ci v seven lt pasi advance v six treatment difference ci v one lt week study adverse event rate to week were icotrokinra placebo respectively most common adverse event were nasopharyngitis upper respiratory tract infection eight to week adverse event rate were lower icotrokinra deucravacitinib interpretation icotrokinra showed superior clinical response rate versus placebo deucravacitinib phase plaque psoriasis trial similar adverse event rate to placebo finding suggest potential oral icotrokinra to provide robust efficacy favourable safety profile funding johnson amp johnson	Lancet	18/09/2025
10.1111/liv.70367	target trial emulation dual agonist to reduce major adverse liver outcome type diabetes	Henney AE; Riley DR; Anson M; Azmi S; Alam U; Cuthbertson DJ	background clinical trial suggest receptor agonist ra dual insulinotropic polypeptide gip ra improve metabolic dysfunction associated steatohepatitis mash patient metabolic steatotic liver disease masld aimed to compare estimate relative effect tirzepatide semaglutide liraglutide reducing risk major adverse liver outcome malos patient type diabetes design setting participant emulated target trial based network electronic health record ehrs million patient three target trial were emulated eligible patient who had prior malo diagnosis comparing therapy involving tirzepatide semaglutide liraglutide versus inhibitor therapy identified diagnosis malo occurring period compared treatment group using survival analysis cohort underwent propensity score matching confounders performed sensitivity analysis relating to geographical location combination metformin treatment adherence also performed analysis therapy result matching identified three target trial comprised patient treated tirzepatide semaglutide liraglutide respectively reference patient period tirzepatide hr ci semaglutide hr were associated significant reduction risk incident malo compared whereas liraglutide wa not hr ci comparison tirzepatide wa associated significantly lower risk incident malo compared liraglutide hr ci not semaglutide hr ci semaglutide wa not associated reduced risk compared liraglutide hr ci conclusion treatment tirzepatide to lesser extent semaglutide patient wa associated lower incidence malo compared year largely driven reduction rate compensated decompensated cirrhosis reduction malo wa not demonstrated use liraglutide finding highlight comparative benefit tirzepatide semaglutide versus should prompt more robust randomised controlled study to evaluate role preventing malo increasingly prevalent patient population masld	Liver Int	01/10/2025
10.1038/s41588-025-02321-z	rapid epigenomic classification acute leukemia	Steinicke TL; Benfatto S; Capilla-Guerra MR; Monteleone AB; Young JH; Shankar S; Michaels PD; Tsai HK; Good JD; Kreso A; van Galen P; Schliemann C; Chen EC; Griffin GK; Hovestadt V	acute leukemia requires precise molecular classification urgent treatment however diagnostic test are do not capture full spectrum acute leukemia heterogeneity here developed framework to classify acute leukemia using dna methylation profiling first assembled comprehensive reference cohort sample defined methylation class classification matched lineage classification most case revealed heterogeneity addition to captured genetic category using reference developed neural network marlin rapid leukemia subtype inference acute leukemia classification sparse dna methylation profile retrospective cohort profiled nanopore sequencing prediction were concordant conventional diagnosis case marlin classification patient suspected acute leukemia provided accurate prediction five five case which were typically generated sample receipt summary present framework rapid acute leukemia classification complement enhances diagnostics	Nat Genet	22/09/2025
10.1177/22799036221110020	health health inequality impact assessment measure to control basque country navarre spain	Urtaran-Laresgoiti M; González-Rábago Y; Martín U; Rivadeneyra-Sicilia A; Morteruel M	article describes result health health inequality impact assessment pandemic control measure region basque country navarre spain literature review wa conducted pubmed web science wos database addition to individual interview focus group expert key informant different profile citizen wide variety social determinant health have been affected measure which included individual behavior service disruption formal care educational setting health care provision change have particularly affected certain population group including child adolescent older people health condition disability together caregiver woman a well people low level education income resource future scenario will be necessary to pay attention to potential impact policy response health inequality to avoid increase existing health gap	J Public Health Res	01/07/2022
10.1519/JSC.0000000000001019	time course resistance muscle hypertrophy elderly	Lixandrão ME; Damas F; Chacon-Mikahil MP; Cavaglieri CR; Ugrinowitsch C; Bottaro M; Vechin FC; Conceição MS; Berton R; Libardi CA	extended period resistance training rt induce muscle hypertrophy nevertheless to date study ha investigated time window necessary to observe significant change muscle area csa older adult therefore study investigated time course muscle hypertrophy week session rt elderly fourteen healthy older subject were randomly allocated rt control group rt wa composed set repetition repetition maximum leg press machine time course vastus lateralis muscle hypertrophy csa wa assessed weekly basis ultrasonography leg press muscle strength wa assessed dynamic test result demonstrated rt group increased leg press week training significant increase vastus lateralis muscle csa were observed only session training week conclusion training protocol promoted muscle mass accrual older subject wa only observable session rt week	J Strength Cond Res	01/01/2016
10.1021/acsnano.5c11211	mesenchymal stem extracellular vesicle ameliorate temporomandibular joint osteoarthritis suppressing osteoclast activity axis	Yang Z; Zhang S; Faqeer A; Anjum S; Deng Y; Cao J; Yu T; Zhang Y	temporomandibular joint osteoarthritis tmjoa is common degenerative oral disease remains one most challenging joint disorder to treat clinically is characterized excessive subchondral bone loss early stage cartilage damage later stage recent year mesenchymal stem cell msc derived extracellular vesicle have attracted widespread attention potential role modulating oa pathology however application tmjoa remains underexplored mechanism underlying therapeutic effect are not fully understood study evaluate therapeutic effect human umbilical cord mesenchymal stem extracellular vesicle tmjoa focus subchondral bone investigate underlying molecular mechanism mirna sequencing result demonstrated treatment significantly reduced osteoclast oc activity transferring which further suppressed expression integrin osteoclast rat tmjoa model injection demonstrated protective effect subchondral bone cartilage primarily suppression osteoclast activity consequently result highlight potential therapy promising effective approach treatment tmjoa	ACS Nano	22/09/2025
10.1126/science.adt1630	predicting interaction human proteome	Zhang J; Humphreys IR; Pei J; Kim J; Choi C; Yuan R; Durham J; Liu S; Choi HJ; Baek M; Baker D; Cong Q	interaction ppi are essential biological function coevolutionary analysis deep learning dl based protein structure prediction have enabled comprehensive ppi identification bacteria yeast approach have had limited success more complex human proteome overcame challenge enhancing coevolutionary signal deeper multiple sequence alignment harvested petabyte unassembled genomic data developing new dl network trained augmented datasets interaction million predicted protein structure systematically screened million human protein pair predicted interaction expected precision which interaction were not identified previous experimental screen model predicted interaction provide numerous hypothesis protein function mechanism human disease	Science	25/09/2025
10.1001/jamaoncol.2025.3700	ribociclib endocrine therapy hormone early breast cancer outcome natalee randomized clinical trial	Fasching PA; Stroyakovskiy D; Yardley DA; Huang CS; Crown J; Bardia A; Chia S; Im SA; Martin M; Xu B; Loi S; Barrios C; Untch M; Moroose R; Visco F; Hortobagyi GN; Slamon DJ; Fresco R; Zarate JP; Li Z; Waters S; Hurvitz SA	importance ribociclib nonsteroidal aromatase inhibitor nsai ha demonstrated statistically significant invasive survival idf benefit nsai alone patient hormone formerly early breast cancer evaluating efficacy safety adjuvant ribociclib planned treatment period is critical understanding impact recurrence objective to evaluate efficacy safety adjuvant ribociclib exploratory analysis natalee new adjuvant trial ribociclib randomized clinical trial patient no longer receiving ribociclib treatment design setting participant exploratory analysis international randomized phase trial analyzed adjuvant treatment premenopausal postmenopausal woman men hormone early breast cancer eligible patient had anatomic stage iia additional risk factor axillary lymph node iib iii disease american joint committee cancer staging manual eighth edition data cutoff date wa april intervention patient were randomized to receive ribociclib mg once daily day cycle month nsai letrozole mg anastrozole mg once daily continuously month nsai alone men premenopausal woman also received goserelin mg once day administered subcutaneously main outcome measure primary end point wa idf secondary efficacy end point included distant survival survival overall survival survival wa evaluated method result patient included analysis median range age year female median idf wa month range month ribociclib nsai continued to show idf benefit nsai alone hazard ratio ci idf rate v difference percentage point rate v difference percentage point efficacy benefit wa consistent subgroup secondary end point overall survival data remain immature trend favor ribociclib nsai nsai alone wa observed hazard ratio ci incidence adverse event ha remained stable conclusion relevance exploratory analysis natalee randomized clinical trial median treatment duration demonstrated consistent idf benefit ribociclib nsai nsai alone trial registration identifier	JAMA Oncol	25/09/2025
10.1002/advs.202509351	nonalcoholic fatty liver disease exacerbates advancement renal fibrosis modulating renal pirb macrophage axis	Wei S; Shou D; Huang S; Wang Y; Liu Q; Liu J; Lv X; Zeng Y; Wei L; Lin H; Chen J; Chen Y; Zhong H; Zhou Y; Ma W; Wang L; Qian G; Guo J; Sun D	renal fibrosis is critical pathological hallmark chronic kidney disease nonalcoholic fatty liver disease nafld ha been implicated kidney disease progression specific role underlying mechanism renal fibrosis remain poorly understood study aim to investigate mechanism establishing mouse model renal fibrosis unilateral ureteral obstruction uuo combined nafld rna sequencing untargeted metabolomics flow cytometry immunofluorescence are performed vitro experiment involving primary renal macrophage coculture model is demonstrated nafld exacerbates renal fibrosis hepatocytes release significant level which activates renal pirb macrophage specialized macrophage disrupt linoleic acid metabolism increase production inflammatory cytokine aggravating renal fibrosis addition pirb macrophage promote activation proliferation cell which can further contribute to worsening renal fibrosis thus axis is crucial signaling pathway liver kidney pirb macrophage play pivotal role progression renal fibrosis finding suggest potential therapeutic target to treat renal fibrosis	Adv Sci (Weinh)	25/09/2025
10.2147/CPAA.S497904	pharmacotherapy obesity recent update	Fredrick TW; Camilleri M; Acosta A	narrative review describe recent update regarding medication february describe physiologic mechanism underpinning development hunger satiation maintenance satiety to address target medication efficacy mechanism additional beneficial effect medication are then further detailed review focus medication obesity select medication currently development undergoing phase trial start focusing medication orlistat phentermine also highlight setmelanotide heritable obesity mechanism action comparative efficacy receptor agonist liraglutide semaglutide are reviewed tirzepatide dual agonist is described weight loss is compared to alternative medication additional incretin target pipeline include dual to glucagon receptor triple agonist targeting glucagon gip novel agonist oral formulation agonist amylin agonist finally provide best practice adjunct to pharmacologic treatment obesity monitoring efficacy obesity treatment adjusting medication regimen provider	Clin Pharmacol	01/01/2025
10.1002/advs.202508574	clinically inspired multimodal treatment using induced neural stem exosomes promotes recovery traumatic brain injury microglial modulation	Li J; Xu M; Cai B; Li X; Liang Z; Xia X; Zhang H; Zhang Z; Tan F; Zheng JC	traumatic brain injury tbi pose serious physical psychosocial economic threat to million patient globally year current treatment option primarily surgery medication vary tbi severity there is universal therapeutic agent applicable surgical medical context present study exosomes derived induced neural stem cell versatile therapeutic agent tbi are investigated using preclinical murine model treatment is found to exert therapeutic effect mediating neuroprotection thereby promoting functional cognitive recovery tbi mouse besides two clinically inspired administration modality are established local delivery systemic delivery efficacy is enhanced novel injectable hydrogel rvg targeting systemic delivery respectively finally unprecedented characterization mouse brain tissue treatment confirms microglia represent predominant type cell affected two microglial subpopulation are identified reduced state differentiation connectivity neuron is predicted activation nrxn signaling pathway overall finding demonstrated offer versatile potent treatment platform clinical potential tbi management	Adv Sci (Weinh)	24/09/2025
10.3389/fnhum.2023.1101432	development running is not related to time onset independent walking longitudinal case study	Bach MM; Zandvoort CS; Cappellini G; Ivanenko Y; Lacquaniti F; Daffertshofer A; Dominici N	introduction child start to run master walking how running develops however is largely unknown method assessed maturity running pattern two very young typically developing child longitudinal design spanning three year leg trunk kinematics electromyography collected six recording session more hundred stride entered analysis recorded walking first session session first independent step two toddler age month fast walking running subsequent session more kinematic neuromuscular parameter were determined session stride equivalent data five young adult served to define mature running dimensionality reduction using principal component analysis hierarchical cluster analysis based average pairwise correlation distance to adult running cluster served measure maturity running pattern result child developed running yet one running pattern did not reach maturity whereas other did expected mature running appeared later session gt month onset independent walking interestingly mature running alternated episode immature running session clustering approach separated discussion additional analysis accompanying muscle synergy revealed participant who did not reach mature running had more difference muscle contraction when compared to adult other one may speculate difference muscle activity may have caused difference running pattern	Front Hum Neurosci	01/01/2023
