DOI	Title	Authors	Abstract	Journal	Date
10.1038/s41413-025-00455-8	research progress sarcopenia musculoskeletal system	Mao X; Lv K; Qi W; Cheng W; Li T; Sun Y; Jin H; Pan H; Wang D	sarcopenia progressive systemic skeletal muscle disorder marked accelerated deterioration muscle function mass is highly prevalent elderly population significantly contributing to elevated risk adverse outcome including fall fracture muscle weakness clinical investigation have identified strong correlation sarcopenia several prevalent degenerative skeletal muscle disorder correlation is attributed to imbalance joint mechanic resulting localized muscle atrophy influence musculoskeletal secretory factor review discus broader implication sarcopenia critically evaluate currently established assessment method furthermore clinical significance prevalent musculoskeletal disorder including osteoporosis osteoarthritis spinal pathology relation to sarcopenia underlying mechanism influencing relationship is summarized additionally effect sarcopenia therapeutic efficacy medication surgical intervention musculoskeletal condition are reviewed sarcopenia is intricately linked to onset progression prognosis musculoskeletal disorder future research should prioritize elucidating potential mechanism that connect muscle loss skeletal muscle disease investigating mitigating sarcopenia symptom could decelerate progression disorder thereby paving new pathway therapeutic intervention	Bone Res	23/09/2025
10.1038/s41582-025-01136-0	progress challenge sporadic cerebellar ataxia	Wirth T; Faber J; Depienne C; Roze E; Honnorat J; Meissner WG; Giunti P; Tranchant C; Klockgether T; Anheim M	sporadic cerebellar ataxia sloca is syndrome defined subacute chronic progressive ataxia occurring age year individual family history ataxia publication revised consensus diagnostic criterion multiple system atrophy emergence promising biomarkers provides thorough diagnostic framework that now enables diagnosis numerous acquired cause sloca including autoimmune disorder neurodegenerative disease ongoing development increased availability dna sequencing technology have uncovered several molecular cause sloca spastic paraplegia type very friedreich ataxia additional cause include sporadic genetic disorder such spinocerebellar atrophy type caused gaa expansion gene cerebellar ataxia neuropathy vestibular areflexia syndrome canvas caused biallelic expansion gene review present updated clinical approach to diagnosis management sloca that focus most important development field future challenge are also discussed including identification additional missing genetic cause sloca especially use genome sequencing improvement sloca prognostication implementation clinical trial neuroprotective intervention	Nat Rev Neurol	22/09/2025
10.1073/pnas.2519568122	crispr screen identify atpase vcp druggable therapeutic vulnerability cholangiocarcinoma	Yang W; Wang S; Ji S; Wang J; Lian S; Li Z; Jansen RA; Wu W; Niu K; Sun Z; Jia Q; Zheng J; Zhu H; Deng X; Wang L; Fan Z; Shi Y; Lieftink C; Guan M; Beijersbergen RL; Qin W; Gao Q; Bernards R; Jin H	cholangiocarcinoma cca remains lethal malignancy limited therapeutic option screening identified adenosine triphosphatase atpase protein vcp critical dependency cca compound screen revealed vcp inhibitor potently suppresses cca proliferation panel organoids inducing cellular senescence is known senescent cell persist can contribute to therapy resistance to address combined senolytic agent conatumumab which selectively eliminate senescent cca cell resulting enhanced tumor suppression vitro vivo clinical analysis showed vcp overexpression cca patient correlate poor prognosis study unveils quot punch quot strategy targeting senescence followed senolytic clearance offering promising therapeutic approach cca	Proc Natl Acad Sci U S A	30/09/2025
10.1093/ehjopen/oeaf117	tirzepatide compared semaglutide cardiovascular disease risk reduction obesity analysis trial	Mamas MA; Bays H; Li R; Upadhyay N; Irani T; Senyucel C; Dunn JP; Liu-Seifert H	aim approximately mortality is attributable to cardiovascular disease cvd aim analysis is to examine predicted cvd risk reduction following weight loss person obesity primary prevention tirzepatide semaglutide projected cvd event that could be potentially prevented usa method result wa phase randomized trial conducted participant obesity diabetes comparing tirzepatide mg semaglutide mg administered weekly subcutaneous injection predicted cvd risk were compared treatment baseline up to week participant prior cvd impact cardiovascular risk reduction wa estimated projected preventable cvd event year tirzepatide semaglutide usa average predicted cvd risk score treatment wa treatment tirzepatide wa associated significantly greater reduction predicted cvd risk compared semaglutide absolute reduction baseline respectively lt translating risk reduction to population who met treatment eligibility criterion prior cvd million estimated million cvd event could be potentially prevented year week tirzepatide treatment million semaglutide conclusion treatment tirzepatide wa associated greater predicted cvd risk reduction compared semaglutide post hoc analysis suggests treatment may provide greater benefit primary prevention cvd semaglutide people obesity overweight registration	Eur Heart J Open	01/09/2025
10.1016/j.ejso.2025.110445	ago breast commission recommendation surgical therapy breast cancer working group gynecologic cancer ago update	Reimer T; Kuehn T; Mueller V; Ditsch N; Fehm T; Albert US; Bartsch R; Bauerfeind I; Bjelic-Radisic V; Blohmer JU; Budach W; Dall P; Fallenberg EM; Fasching PA; Friedrich M; Gerber B; Gluz O; Harbeck N; Hartkopf A; Heil J; Hoerner-Rieber J; Huober J; Janni W; Kreipe HH; Krug D; Kuemmel S; Loibl S; Lueftner D; Lux MP; Maass N; Mundhenke C; Park-Simon TW; Reinisch M; Rhiem K; Rody A; Schmidt M; Schneeweiss A; Schuetz F; Sinn HP; Solbach C; Solomayer EF; Stickeler E; Thomssen C; Untch M; van Mackelenbergh M; Witzel I; Woeckel A; Wuerstlein R; Banys-Paluchowski M; Thill M	german guideline commission working group gynecologic cancer updated recommendation diagnosis treatment breast cancer march chapter oncological surgery are coordinated working group plastic aesthetic reconstructive surgery gynecology awogyn most important change include incorporation insema sound trial result guideline patient characteristic defined age year postmenopausal status hormone subtype tumor grading maximum preoperative size cm unsuspicious axillary ultrasound clinical examination sentinel lymph node biopsy slnb can be omitted surgery irradiation are planned patient macrometastatic sentinel lymph node slns undergoing mastectomy postoperative irradiation completion axillary lymph node dissection alnd is longer recommended neoadjuvant systemic therapy nst alnd is recommended targeted axillary dissection tad show macrometastases sentinel target lymph node node that wa marked had macrometastasis biopsy nst patient isolated tumor cell sentinel target lymph node should not receive alnd nst case status decision to perform completion alnd should be made basis oncoplastic surgery is safe may replace mastectomy select case	Eur J Surg Oncol	17/09/2025
10.1136/bmjebm-2025-113913	alcohol use risk dementia diverse population evidence cohort mendelian randomisation approach	Topiwala A; Levey DF; Zhou H; Deak JD; Adhikari K; Ebmeier KP; Bell S; Burgess S; Nichols TE; Gaziano M; Stein M; Gelernter J	objective to investigate relationship alcohol consumption dementia design prospective cohort analysis combined linear mendelian randomisation setting two cohort million veteran programme uk biobank genetic analysis used summary statistic association study gwas participant adult aged year baseline were included observational analysis mean year cohort year uk cohort genetic analysis used summary data multiple large gwas consortium million participant main outcome measure incident dementia determined health record linkage genetic proxy result participant developed dementia died observational analysis revealed association alcohol dementia risk higher risk wa observed heavy drinker gt drink week ci to alcohol use disorder aud hr ci to compared light drinker contrast mendelian randomisation genetic analysis identified monotonic increase dementia risk greater alcohol consumption sd increase drink week wa associated dementia increase weighted ivw ci to twofold increase aud prevalence wa associated increase dementia risk ivw ci to alcohol intake increased dementia individual who developed dementia also experienced decline alcohol intake time suggesting reverse early cognitive decline lead to reduced supposed protective alcohol effect observational study conclusion finding provide evidence relationship type alcohol use increased dementia risk correlational observational data suggested protective effect light drinking could be part attributable to reduced drinking seen early dementia genetic analysis did not support protective effect suggesting level alcohol consumption may contribute to dementia risk public health strategy that reduce prevalence alcohol use disorder could potentially lower incidence dementia to	BMJ Evid Based Med	23/09/2025
10.1016/j.heliyon.2023.e19582	antibacterial activity mechanism cinnamon essential oil nanoemulsion pseudomonas deceptionensis	Zhao D; Ma Y; Wang W; Xiang Q	work aimed to evaluate antibacterial activity mechanism cinnamon essential oil nanoemulsion con pseudomonas deceptionensis result revealed con could effectively inhibit proliferation deceptionensis cell manner incubation con minimum inhibitory concentration relative fluorescence intensity propidium iodide npn wa increased respectively membrane permeability deceptionensis cell wa significantly disrupted con treatment resulting leakage intracellular substance such protein electrolyte con also caused significant increase dibac fluorescence intensity deceptionensis cell result demonstrate con induced inactivation deceptionensis destroying integrity function bacterial membrane higher level intracellular reactive oxygen specie ro wa observed cell lt compared control cell moreover addition glutathione to growth medium remarkably decreased antimicrobial activity con deceptionensis further confirming oxidative stress played important role antimicrobial activity con overall con may exhibit antibacterial effect causing damage to bacterial membrane oxidative stress	Heliyon	01/09/2023
10.1093/nar/gkaf920	protein regulates dna mismatch repair gene implication genome stability	Provasek VE; Bacolla A; Rangaswamy S; Kodavati M; Mitra J; Yusuf IO; Malojirao VH; Vasquez V; Britz GW; Li GM; Xu Z; Mitra S; Garruto RM; Tainer JA; Hegde ML	is protein increasingly recognized role neurodegenerative condition including amyotrophic lateral sclerosis al frontotemporal dementia ftd characterized aberrant nuclear export cytoplasmic aggregation proteinopathy is hallmark feature case leading to detrimental cytosolic aggregate reduction nuclear functionality neuron building prior work linking proteinopathy to accumulation dna break dsbs neuron present investigation uncovers novel regulatory relationship dna mismatch repair mmr gene expression here show depletion overexpression directly affect expression key mmr gene alteration include change level various primary cell line independent proliferative status result specifically establish selectively influence expression influencing alternative transcript splicing pattern stability furthermore find aberrant mmr gene expression is linked to proteinopathy two distinct al mouse model brain spinal cord tissue al patient notably mmr depletion resulted partial rescue dna damage signaling moreover bioinformatics analysis tcga cancer database reveals significant association expression mmr gene expression mutational burden multiple cancer collectively finding implicate critical regulator mmr pathway unveil broad impact etiology neurodegenerative neoplastic pathology	Nucleic Acids Res	23/09/2025
10.1586/17512433.2014.944502	new problem arising old drug effect acetaminophen	Tiegs G; Karimi K; Brune K; Arck P	acetaminophen apap is one most commonly used drug taken worldwide treatment pain fever considered safe when taken recommended dos not higher apap overdose is currently most important cause acute liver failure alf alf may require liver transplantation can be fatal reason alf are mostly intentional suicidal unintentional overdose however result large scale epidemiological study provide increasing evidence second generation effect apap even when taken pharmacological dos most strikingly apap medication pregnancy ha been associated health problem including neurodevelopmental behavioral disorder such attention deficit hyperactivity disorder increase risk wheezing incidence asthma offspring article review epidemiological finding aim to shed light molecular cellular mechanism responsible prenatal risk asthma	Expert Rev Clin Pharmacol	01/09/2014
10.1038/s41590-025-02283-8	sting signal to late endolysosomal compartment using adaptor	Zhang BC; Pedersen A; Reinert LS; Li Y; Narita R; Idorn M; Hu L; Skouboe MK; Li S; Maimaitili M; Ding X; Cong Y; Zhao J; Frémond ML; Mikkelsen K; Gao Z; Huang JR; Thomsen EA; Mikkelsen JH; Venkatraman R; Thomsen MK; Iversen MB; Assil S; Zhang R; Henneman L; Jakobsen MR; Oxvig C; Dalgaard TS; Møller P; Fago A; Wang T; Andersen CBF; De Nardo D; Reggiori F; Ting JP; Mikkelsen JG; Bak RO; Mogensen TH; Li P; Paludan SR	is central activation immune response cytosolic dna activates pathway to induce type interferon ifns signaling thus instigating host defense pathological inflammation however mechanism underlying activation is unknown here report sting activates delayed manner following exit golgi to endolysosomal compartment activation is dependent transcription factor is independent type ifn signaling activation pattern is evolutionarily conserved tetrapod mechanistically monomer is recruited to sting delayed kinetics relative to recruitment to sting which promotes type ifn response engagement sting induces trafficking to late endolysosomal compartment supporting recruitment activation identify binding motif facilitates recruitment work defines signaling surface sting function adaptor immune signaling finding indicate sting signaling to is enabled only short time window exit golgi lysosomal degradation possibly limiting inflammation homeostatic condition	Nat Immunol	19/09/2025
10.1001/jamanetworkopen.2025.33815	olfactory dysfunction infection recover adult cohort	Horwitz LI; Becker JH; Huang W; Akintonwa T; Hornig-Rohan MM; Maranga G; Adams DR; Albers MW; Ayache M; Berry J; Brim H; Bryan TW; Charney AW; Clark RA; Cortez MM; D&#x27;Anza B; Davis H; Donohue SE; Erdmann N; Flaherman V; Fong TG; Frontera JA; Goldberg MP; Goldman JD; Harkins MS; Hodder SL; Jacoby VL; Jagannathan P; Jia X; Kelly JD; Krishnan JA; Kumar A; Laiyemo AO; Levitan EB; Martin JN; McCaffrey KM; McComsey GA; Metz TD; Murthy G; Nguyen H; Okumura M; Parry S; Parthasarathy S; Patterson TF; Peluso MJ; Sorochinsky C; Walker T; Wiegand SL; Wiley Z; Wisnivesky J; Ashktorab H; Foulkes A; Lee-Iannotti JK	importance olfactory dysfunction is common infection ha been associated cognitive loss other condition formal testing is needed to characterize presence severity pattern olfactory dysfunction objective to characterize olfactory dysfunction infection design setting participant prospective cohort study included adult enrolled researching covid to enhance recovery recover study all random sample change loss smell taste were offered olfactory testing performed site state territory participant included enrollee prior infection change loss prior infection change loss taste who underwent olfactory testing mean sd day index date data were collected october to june exposure infection main outcome measure olfactory function defined performance university pennsylvania smell identification test upsit test comprising unique odor result study included participant mean sd age year data available were female intersex infected participant change loss had hyposmia upsit including severe microsmia anosmia infected participant change loss had hyposmia including severe microsmia anosmia participant prior infection change loss scored upsit percentile compared percentile change loss prior known infection respectively younger woman had score corresponding to lower mean percentile participant who change loss smell abnormal upsit score more often reported cognitive problem normal upsit score conclusion relevance cohort study participant change loss smell taste wa accurate signal verified hyposmia high rate hyposmia reported change loss wa also observed formal smell testing may be considered prior infection to diagnose occult hyposmia counsel patient risk	JAMA Netw Open	02/09/2025
10.1038/s41581-025-01004-6	immunology sepsis translating new insight clinical practice	Kox M; Bauer M; Bos LDJ; Bouma H; Calandra T; Calfee CS; Chousterman BG; Derde LPG; Giamarellos-Bourboulis EJ; Gómez H; Netea MG; Ostermann M; van der Poll T; Scicluna BP; Seymour C; Shankar-Hari M; Shapiro N; Singer M; Venet F; Vlaar APJ; van Vught LA; Weis S; Joost Wiersinga W; Pickkers P	sepsis is defined organ dysfunction caused dysregulated host response to infection treatment that influence dysregulated host response are sparse immunopathophysiology sepsis entail overzealous inflammation causing acute organ dysfunction a well profound persistent response that increase susceptibility to secondary infection immune response sepsis is influence various endogenous exogenous factor including genetic makeup age sex comorbidities metabolism prior microbial exposure medication consequent heterogeneity syndrome hamper immunomodulatory treatment strategy that rely approach precision medicine approach is therefore warranted balanced application strategy is instrumental to achieve precision medicine phenotyping patient using clinical physiological microbiological molecular omics data enables identification more homogeneous patient subgroup several study suggest such approach can be used to tailor adjunctive immunomodulatory therapy patient sepsis a well repurposing existing drug to treat sepsis new drug aimed restoring immune homeostasis are investigation new clinical trial methodology including flexible platform trial bayesian statistic embedding trial health care system are increasingly being used to keep pace rapid development field sepsis immunobiology ultimately to improve clinical outcome	Nat Rev Nephrol	24/09/2025
10.1016/S0140-6736(25)01438-2	future type diabetes therapy	Ziegler AG; Cengiz E; Kay TWH	treatment type diabetes is entering transformative era teplizumab first immunotherapy treatment to delay onset clinical type diabetes ha been approved food drug administration other therapy show promise preserving function public health screening using islet autoantibody is expanding enabling earlier diagnosis reducing diabetic ketoacidosis allowing timely introduction treatment need insulin therapy replacement is shifting traditional transplantation organ donor islet pancreas to stem cell bioengineering method such encapsulation gene editing to create hypoimmune cell could reduce need immunosuppression that ha hampered replacement stem cell open door to personalised therapy innovation have been made available to small number patient scaling to widespread use remains challenge meanwhile glucose regulation is improving use automated insulin delivery system that combine glucose monitoring insulin pump insulin that are ultrarapid ultralong improve outcome minimising blood sugar fluctuation together breakthrough offer renewed hope improving management quality life people living type diabetes	Lancet	19/09/2025
10.1002/alz.70730	deficiency permit development lewy body dementia coexisting aβ pathology	Gao TY; Wang XZ; Xie YH; Wang T; Lu YB; Huang LL; Chen C; Zhang M; Ma X; Chen YL; Liang FX; Lou ZL; Li JS; Yu YF; Wu JB; Ma XR; Wang HL; Tang C; Zhang WP	introduction dementia lewy body dlb prevalent neurodegenerative dementia involves aggregate frequent amyloid beta aβ mechanistic driver remain unclear method crossed knockout mouse assessed behavioral pathological phenotype resulting animal also performed biochemical biophysical characterization kinase phosphorylation result dlb brain show deficiency aβ mirroring human dlb patient mouse spontaneously develop lewy pathology endogenous level affecting central peripheral nervous system heterogeneous phenotype mechanistically phosphorylates suppressing aggregation moreover level are correlated expression activity human brain discussion deficiency synergizes aβ to promote lewy pathology loss protective phosphorylation model recapitulates key dlb feature overexpression offering valuable tool future mechanistic therapeutic study highlight kinase deficiency reduced expression impaired activity is found human dementia lewy body dlb patient amyloid beta aβ specifically phosphorylates inhibiting aggregation preventing development lewy pathology mouse model recapitulates key feature human dlb exhibiting widespread lewy pathology heterogeneous phenotype alteration emerge novel genetic risk factor dlb opening new avenue diagnosis therapeutic intervention	Alzheimers Dement	01/09/2025
10.1038/s41467-025-63395-1	clinical implication bone marrow adiposity identified association mendelian randomization uk biobank	Xu W; Mesa-Eguiagaray I; Morris DM; Wang C; Gray CD; Sjöström S; Papanastasiou G; Badr S; Paccou J; Wang L; Li X; Timmers PRHJ; Timofeeva M; Semple SI; MacGillivray T; Theodoratou E; Cawthorn WP	bone marrow adiposity change diverse disease full scope are directly influenced marrow adiposity remains unknown to address previously measured bone marrow fat fraction femoral head total hip femoral diaphysis spine uk biobank participant here first use data phewas to identify disease associated marrow adiposity site reveals association incident disease disease category including osteoporosis fracture type diabetes cardiovascular disease cancer other condition that burden public health worldwide intriguingly type diabetes associate positively spine bone marrow adiposity negatively marrow adiposity femoral site then establish prss based snp use mendelian randomization to explore causal association marrow adiposity disease reveals that genetic predisposition to increased marrow adiposity is positively associated osteoporosis fracture mendelian randomization further suggests increased marrow adiposity diaphysis total hip is causally associated osteoporosis finding substantially advance understanding how marrow adiposity impact human health highlight potential biomarker therapeutic target diverse human disease	Nat Commun	23/09/2025
10.1038/s41586-021-03279-8	centromere are dismantled foundational meiotic protein	Hou H; Kyriacou E; Thadani R; Klutstein M; Chapman JH; Cooper JP	meiotic process are potentially dangerous to genome stability could be disastrous activated proliferative cell here show two key protein topoisomerase which form break meiotic cohesin can dismantle centromere dismantlement is normally observable only mutant cell that lack telomere bouquet which provides nuclear microdomain conducive to centromere reassembly however overexpression lead to level centromere dismantlement that can not be countered bouquet specific nucleosome remodelling factor mediate centromere dismantlement ectopic expression protein proliferating cell lead to loss mitotic kinetochore fission yeast human cell hence centromeric chromatin ha been characterized extraordinarily stable challenge stability may jeopardize kinetochore cancer that express meiotic protein	Nature	01/03/2021
10.1038/s41418-025-01584-7	novel lncrna modulates neural pyroptosis associated epilepsy stabilizing	Wang H; Wu L; Liu C; Zhao X; Cui L; Gao J; Zhang C; Du T; Shi L; Ji Y; Xiao Y; Zhang J; Tu W; Meng F; Han C	pyroptosis is strongly associated refractory epilepsy however underlying mechanism remain poorly understood increasing evidence ha shown long noncoding rna lncrnas participate various neurological disorder process regulating programmed cell death study identified novel lncrna screening which suppresses neural pyroptosis epilepsy demonstrated is aberrantly underexpressed hippocampus cortex epilepsy patient phenomenon that wa validated various mouse rat epilepsy model sirna viral manipulation experiment confirmed inhibits neuronal pyroptosis vivo vitro exerts antiepileptic effect mechanistically act scaffold to modulate protein stabilization enhancing ubiquitination thereby inhibiting neural pyroptosis suppression inflammasome signalling additionally downstream cytokine pyroptosis inhibit expression activation shared pathway pathway forming feedback loop finding identify critical regulator neural cell pyroptosis promising therapeutic target refractory epilepsy	Cell Death Differ	22/09/2025
