DOI	Title	Authors	Abstract	Journal	Date
10.1111/ppe.12615	acetaminophen use pregnancy risk attention deficit hyperactivity disorder causal association bias	Masarwa R; Platt RW; Filion KB	background association acetaminophen use pregnancy development attention deficit hyperactivity disorder adhd offspring may be due to bias objective primary objective wa to assess role potential unmeasured confounding estimation association acetaminophen use pregnancy risk adhd bias analysis secondary objective wa to assess role selection bias exposure misclassification data source searched medline embase scopus cochrane library up to december study selection data extraction included observational study examining association acetaminophen use pregnancy risk adhd synthesis data study using model conducted bias analysis to study that did not adjust important confounders to explore systematic error related to unmeasured confounding selection bias exposure misclassification result search resulted seven study included when adjusted estimate were pooled study risk ratio rr adhd wa confidence interval ci sensitivity analysis unmeasured confounding showed confounder rr scale would reduce to proportion study true effect size rr gt unmeasured confounding bias analysis decreased point estimate five seven study increased two study suggesting observed association could be confounded parental adhd unadjusted risk ratio bcrrs were rr bcrr rr bcrr rr bcrr rr bcrr rr bcrr rr bcrr rr bcrr conclusion bias analysis suggests previously reported association acetaminophen use pregnancy increased risk adhd offspring may be due to unmeasured confounding ability to conclude causal association is limited	Paediatr Perinat Epidemiol	01/05/2020
10.1038/s41586-025-09574-y	is required maintaining mesenchymal cell fate pancreatic cancer	Li H; Lan L; Chen H; Zaw Thin M; Ps H; Nelson JK; Evans IM; Ruiz EJ; Cheng R; Tran L; Allen M; Ma J; Yi T; Wang C; He Y; Guppy N; Sadanandam A; Lin SZ; Zhang C; Behrens A	elucidating complex network communication tumour cell is central to understanding cell fate decision progression pancreatic ductal adenocarcinoma pdac previously showed constant suppression bmp activity bmp antagonist secreted mesenchymal pdac cell is essential maintaining fate epithelial pdac cell here identify also known osteopontin key regulator mesenchymal cell fate pancreatic cancer proteomic analysis plasma patient pdac showed is substantially upregulated disease inactivation led to delay tumorigenesis mouse pdac model abolished metastasis formation wa expressed epithelial pdac cell inactivation resulted conversion mesenchymal to epithelial pdac cell mechanistically receptor mesenchymal pdac cell to induce expression inhibition bmp signalling wa required expression epithelial cell thereby forming intercellular regulatory loop concomitant inactivation reverted epithelial phenotype knockout to fully mesenchymal pdac conversely heterozygosity combined knockout resulted pdac histology result that confirmed direct antagonistic function factor hence mesenchymal epithelial pdac cell fate are determined reciprocal paracrine regulation soluble factor	Nature	24/09/2025
10.1038/s42255-025-01379-7	cholesterol metabolic reprogramming mediates chronic neuroinflammation hinders neurorestoration following stroke	Zhao Q; Li J; Feng J; Wang X; Liu Y; Wang F; Liu L; Jin B; Lin M; Wang YC; Guo X; Chen J; Hao J	chronic neuroinflammation is major obstacle to recovery underlying mechanism particularly link prolonged microglial activation cholesterol metabolism are not fully known here show ischaemic injury induces persistent microglial activation that perpetuates chronic inflammation leading to microglial cholesterol accumulation metabolic reprogramming using rna sequencing identified distinct foamy microglia cluster characterized extensive reprogramming cholesterol metabolism furthermore direct intracerebral free cholesterol cholesterol crystal infusion recapitulated sustained microglial activation directly linking aberrant cholesterol metabolism to prolonged neuroinflammatory response therapeutically demonstrate reducing microglial cholesterol overload genetic pharmacological activation male mouse promotes white matter repair functional recovery finding highlight microglial cholesterol metabolism key driver inflammation offering therapeutic strategy targeting cholesterol metabolism to mitigate brain damage promote neurorestoration potentially improving disability outcome	Nat Metab	23/09/2025
10.1186/s12933-025-02921-3	association index combined body shape index cardiovascular mortality individual syndrome stage finding two prospective cohort	Chen M; Guo J; Shangguan Y; Sun Z; He X; Tu Q; Yan Q	background tyg index measure insulin resistance ha been confirmed to be associated adverse clinical outcome new composite indicator body type index integrating tyg index body type index ha demonstrated superior efficacy predicting risk cardiovascular death general population compared to traditional indicator study aim to deeply explore association mortality cvd mortality population cardiovascular syndrome ckm stage analysis will be conducted multiple dimension such intensity indicator correlation potential influencing mechanism order to comprehensively reveal relationship two result analyzed data participant nhanes cohort using cox proportional hazard model restricted cubic spline function result indicated elevated value were independently associated higher risk mortality hr ci cardiovascular mortality hr ci receiver operating characteristic roc curve concordance index evaluation demonstrated yielded more accurate prognostic performance other metric area curve auc indicator reached prediction mortality risk year prediction cardiovascular mortality risk external validation using charls data confirmed robustness finding predicting mortality conclusion individual ckm stage demonstrates stronger association mortality risk superior predictive ability compared other metric performance suggests potential role capturing variation diverse clinical subgroup informing optimal timing preventive intervention	Cardiovasc Diabetol	23/09/2025
10.1016/S1474-4422(25)00270-4	diagnosis multiple sclerosis revision mcdonald criterion	Montalban X; Lebrun-Frénay C; Oh J; Arrambide G; Moccia M; Pia Amato M; Amezcua L; Banwell B; Bar-Or A; Barkhof F; Butzkueven H; Ciccarelli O; Chataway J; Cohen JA; Comi G; Correale J; Deisenhammer F; Filippi M; Fiol J; Freedman MS; Fujihara K; Granziera C; Green AJ; Hartung HP; Hellwig K; Kappos L; Kimbrough D; Killestein J; Lublin F; Marignier R; Ann Marrie R; Miller A; Otero-Romero S; Ontaneda D; Ramanathan S; Reich D; Rocca MA; Rovira À; Saidha S; Salter A; Sastre-Garriga J; Saylor D; Solomon AJ; Sormani MP; Stankoff B; Tintore M; Tremlett H; Van der Walt A; Viswanathan S; Wiendl H; Wildemann B; Yamout B; Zaratin P; Calabresi PA; Coetzee T; Thompson AJ	advance understanding multiple sclerosis development biomarkers pathophysiology prompted substantial revision mcdonald diagnostic criterion new mcdonald criterion provide unified approach diagnosing multiple sclerosis individual relapsing progressive course lifespan ie paediatric to presentation optic nerve can now serve fifth anatomical location cns diagnosis central vein sign paramagnetic rim lesion kappa chain concentration csf can be used when available to provide supportive evidence confer specificity diagnosis multiple sclerosis specific situation certain case radiologically isolated syndrome neurological symptom that do not constitute clear attack progression disability can fulfil criterion multiple sclerosis diagnosis also provide guidance diagnosis multiple sclerosis older individual year comorbidities revised criterion should expedite diagnosis multiple sclerosis maintaining specificity	Lancet Neurol	01/10/2025
10.3390/ijms21030969	precision psychiatry application pharmacogenomics artificial intelligence machine learning approach	Lin E; Lin CH; Lane HY	growing body evidence now suggests precision psychiatry interdisciplinary field psychiatry precision medicine pharmacogenomics serf indispensable foundation medical practice offering accurate medication accurate dose accurate time to patient psychiatric disorder light latest advancement artificial intelligence machine learning technique numerous biomarkers genetic locus associated psychiatric disease relevant treatment are being discovered precision psychiatry research employing neuroimaging review focus latest development precision psychiatry research using artificial intelligence machine learning approach such deep learning neural network algorithm together neuroimaging data firstly review precision psychiatry pharmacogenomics study that leverage various artificial intelligence machine learning technique to assess treatment prediction prognosis prediction diagnosis prediction detection potential biomarkers addition describe potential biomarkers genetic locus that have been discovered to be associated psychiatric disease relevant treatment moreover outline limitation regard to previous precision psychiatry pharmacogenomics study finally present discussion direction challenge future research	Int J Mol Sci	01/02/2020
10.1177/1060028015606469	association prenatal acetaminophen exposure future risk attention disorder child	Hoover RM; Hayes VA; Erramouspe J	objective to evaluate effect prenatal acetaminophen exposure future development attention disorder adhd child data source literature search medline to june international pharmaceutical abstract to june cochrane database publication june prospective clinical trial assessing relationship prenatal acetaminophen exposure development attention deficit disorder hyperactivity study selection data extraction study comparing maternal acetaminophen use pregnancy to development adhd behavior offspring age year data synthesis four study examining effect prenatal acetaminophen exposure subsequent adhd behavior were identified one early study found link to adhd behavior other study found statistically significant correlation most prominent being study finding higher risk using adhd medication hazard ratio ci having behavior age year determined strength difficulty questionnaire risk ratio ci child whose mother used acetaminophen pregnancy conclusion there doe appear to be mild correlation prenatal acetaminophen use development adhd symptom child current data do not provide sufficient evidence prenatal acetaminophen exposure lead to development adhd symptom late life acetaminophen is preferred option pain management pregnancy when compared other medication such nonsteroidal drug opioids pyretic pain relief	Ann Pharmacother	01/12/2015
10.1007/s10549-022-06562-y	feasibility using autologous breast cancer vaccine to induce immunity patient stage metastatic breast cancer	Anderson KS; Erick TK; Chen M; Daley H; Campbell M; Colson Y; Mihm M; Zakka LR; Hopper M; Barry W; Winer EP; Dranoff G; Overmoyer B	purpose antigenic target immunity role vaccination breast cancer are unknown performed phase study autologous breast cancer vaccine patient metastatic stage breast cancer method tumor cell patient metastatic stage disease were transduced adenoviral vector encoding then irradiated twelve seven patient metastatic stage disease respectively received weekly vaccination three week followed other week disease progression vaccine supply wa exhausted metastatic six total vaccine dos were administered stage result patient metastatic disease who received vaccination eight had progressive disease two month three had stable disease month one ha had evidence disease year patient stage disease five died metastatic disease year start vaccination median year two are alive september toxicity included injection site reaction fatigue fever upper respiratory symptom joint pain nausea edema four five evaluable patient metastatic disease developed skin reaction immune cell infiltration fifth injection unmodified irradiated tumor cell conclusion conclude tumor cell can be harvested patient metastatic stage breast cancer to prepare autologous vaccine that induce coordinated immune response limited toxicity trial registration date registration april april	Breast Cancer Res Treat	01/07/2022
10.1016/j.cmet.2025.08.009	glutamine competition tumor macrophage dictate immunotherapy efficacy breast cancer	Xiao Y （肖毅）; Xu Y （徐颖）; Wang H （王晗）; Yang F （杨帆）; Ding XH （丁晓洪）; Fu T （傅彤）; Chen L （陈力）; Jin X （金希）; Zhao YX （赵雅鑫）; Wang Y （王莹）; Chen F （陈芬芳）; Shao ZM （邵志敏）; Jiang YZ （江一舟）	immunotherapy demonstrates limited efficacy breast cancer tnbc influenced intricate metabolic interaction tumor microenvironment here developed rna sequencing immunotherapy cohort spatial transcriptomics cohort to elucidate metabolic crosstalk associated therapeutic efficacy tnbc illustrated heme binding protein high tumor cell featured active glutathione metabolism macrophage characterized oxidative metabolism indicated immunotherapy efficacy were quantitatively spatially negatively correlated glutamine cell type induced phenomenon mechanistically disrupted cytoplasmic phase separation promoting nuclear translocation to upregulate glutathione expression glutamine consumption tumor cell metabolic shift induced ferroptosis macrophage impairing antitumor immunity utilization inhibitor sensitized tnbc to immunotherapy collectively delineate metabolic checkpoint governed axis pioneer immunometabolism paradigm evaluating immunotherapeutic vulnerability	Cell Metab	23/09/2025
10.1007/s00421-010-1658-5	association basal serum bdnf cardiorespiratory fitness cardiovascular disease risk factor untrained healthy korean men	Jung SH; Kim J; Davis JM; Blair SN; Cho HC	evidence suggests serum neurotrophic factor serum bdnf can be affected cardiorespiratory fitness crf relationship is far clear recent report show inverse relationship serum bdnf crf healthy individual other study suggest possible association serum bdnf cardiovascular disease however possible interaction serum bdnf crf cardiovascular disease risk ha not been studied purpose study wa to examine association serum bdnf crf cardiovascular disease risk factor healthy men investigation involved large sample men age range year who live central area south korea were recruited preventive health study study showed significant inverse relationship serum bdnf relative vo max lt heart rate reserve lt serum bdnf wa positively correlated body mass index lt total cholesterol lt triglyceride lt data suggest serum bdnf may be associated effect increased crf cardiovascular disease however more research is clearly needed determination to what extent serum bdnf may be responsible health benefit associated crf	Eur J Appl Physiol	01/02/2011
10.4088/JCP.18m12612	prenatal exposure to acetaminophen risk disorder nationwide study taiwan	Chen MH; Pan TL; Wang PW; Hsu JW; Huang KL; Su TP; Li CT; Lin WC; Tsai SJ; Chen TJ; Bai YM	background study have suggested significant association exists prenatal exposure to acetaminophen offspring disorder adhd risk however association ha largely been unexplored asian population generally taiwanese population specifically method study study pair child adhd code mother control pair child adhd mother matched demographic characteristic were identified taiwan longitudinal health insurance database maternal use acetaminophen wa assessed first trimester second trimester third trimester pregnancy period month pregnancy to date last menstrual cycle result logistic regression analysis adjustment demographic data gestational infection comorbid perinatal condition maternal mental health disorder indicated exposure to acetaminophen second trimester odds ratio ci both first second trimester ci trimester ci wa associated increased risk adhd offspring sensitivity analysis excluding gestational infection maternal mental health disorder confirmed association ci conclusion prenatal exposure to acetaminophen wa associated increased risk adhd offspring regardless gestational infection maternal mental health disorder additional study are necessary to clarify underlying mechanism which prenatal exposure to acetaminophen lead to neurodevelopmental risk	J Clin Psychiatry	10/09/2019
10.1038/s41591-025-03937-8	cell systemic lupus erythematosus phase trial	Feng J; Huo D; Hong R; Jin X; Cao H; Shao M; Wen R; Zhang Q; Zhang M; Fu S; Wang D; Xu H; Wei G; Cui J; Huang S; Cui D; Chang AH; Liu Z; Lu L; Lin J; Hu Y; Huang H	systemic lupus erythematosus sle remains refractory to conventional immunosuppression subset patient sle show peripheral cell bone marrow plasma cell are dominant autoantibody source motivating dual bcma targeting here report result cohort patient female one male ongoing phase trial autologous chimeric antigen receptor car cell lymphodepletion primary endpoint were toxicity dlts day adverse event week key secondary endpoint comprised attainment lupus low disease activity state lldas doris remission week vivo persistence week exploratory endpoint were duration cell depletion time to recovery kinetics immune reconstitution longitudinal change autoantibody titer serum immunoglobulin concentration therapy median range dlts occurred grade cytokine release syndrome developed patient neurotoxicity death most common grade higher adverse event were neutropenia thrombocytopenia anemia which were reversible supportive care week patient fulfilled lldas doris remission criterion multiomic analysis confirmed elimination autoreactive clone reconstitution naive cell durable downregulation signature indicating improved immune homeostasis longitudinal monitoring three patient year demonstrated sustained eradication pathogenic clone suggesting potential cure dual cell therapy demonstrates good safety promising clinical efficacy sle study support further development treatment approach patient rsle identifier	Nat Med	24/09/2025
10.1136/gutjnl-2025-335642	alleviated cell exhaustion dictate chemoimmunotherapy efficacy oesophageal squamous cell carcinoma	Xiang S; Chen Y; Wang C; Wang M; He Y; Liu Z; Zhang JL; Yang LP; Wei YF; Wu QN; Wang ZX; Xi SY; Li Z; Zhao Q; Xu RH; Wang F	background combining chemotherapy cell death improves clinical outcome oesophageal squamous cell carcinoma escc yet underlying synergistic mechanism remains obscured moreover patient still derive therapeutic benefit combination strategy highlighting need to decipher overcome resistance objective sought to investigate mechanism which chemotherapy augments response to immune checkpoint blockade elucidate factor contributing to persistent resistance patient design designed systematic investigation involving longitudinal sampling escc tissue patient treated chemotherapy monotherapy tumour microenvironment tme wa then comprehensively characterised using transcriptomics cell receptor repertoire analysis multiplex immunohistochemistry murine model result demonstrated combination therapy exerted superior antitumour efficacy mitigating immune checkpoint engagement tumour cell cell thereby preventing cell exhaustion boosting vitality identified subset tumour cell high expression which localised tumour boundary interacted myofibroblastic fibroblast inducing extracellular tme that hindered infiltration cell inhibiting significantly enhanced efficacy chemotherapy underscoring potential therapeutic target conclusion study elucidates synergistic mechanism identifies key resistance pathway underlying combination patient escc providing scientific basis refining future combination therapeutic regimen	Gut	22/09/2025
10.1038/s41418-025-01587-4	lactylation promotes ferroptosis diabetic nephropathy	Hong J; Xu H; Yu L; Yu Z; Chen X; Meng Z; Zhu J; Li J; Zhu M	diabetic nephropathy dn is primary cause renal disease worldwide recent study have revealed histone lactylation which function novel epigenetic modification is involved occurrence development complication however little is known role lactyltransferase dn synthetase wa identified novel lactyltransferase that modulates histone lactylation present study determined participates pathogenesis dn more importantly explored potential mechanism involved mouse dn model consisting synthetase heterozygote mouse wa utilized study transcriptomic lipidomic analysis combined variety molecular biological methodology were employed to elucidate potential mechanism which regulates ferroptosis dn result indicated increase expression were involved kidney dysfunction renal cell death modulation ferroptosis dn model moreover induced lipid peroxidation increasing fatty acid transcription ultimately contributing to ferroptosis induction furthermore interacted signal transducer activator transcription to jointly regulate transcription additionally treatment inhibitor fludarabine delayed dn progression addition observed modulated lactylation to regulate transcription thus triggering ferroptosis inhibition lactylation attenuated ferroptosis dn model mouse hyperglycaemic cell present study showed induced lactylation to regulate transcription thus triggering ferroptosis diabetic nephropathy model	Cell Death Differ	23/09/2025
10.1038/s41564-025-02120-6	nasal staphylococcus aureus carriage promotes depressive behaviour mouse sex hormone degradation	Xiang G; Wang Y; Ni K; Luo H; Liu Q; Song Y; Miao P; He L; Jian Y; Yang Z; Chen T; Xu K; Sun X; Shen Z; Ji C; Zhao N; He M; Pan Y; Luo Y; Hu J; Otto M; Li M	human microbiome ha pronounced impact human physiology behaviour unique anatomical connection to brain role nasal microbiome neurological disease is understudied here using human data experiment mouse show nasal staphylococcus aureus is linked to depression microbiome analysis revealed positive correlation depression score aureus abundance patient depression healthy control metabolomics nasal cavity showed decreased sex hormone estradiol testosterone patient depression versus control nasal microbiota transplant patient reproduced behaviour mouse differential abundance aureus further homology mutational analysis uncovered aureus sex enzyme dehydrogenase which degraded testosterone estradiol mouse leading to lower level dopamine serotonin murine brain finding reveal nasal commensal that influence depressive behaviour provides insight axis	Nat Microbiol	22/09/2025
10.1038/s41392-025-02391-9	mediates cell lysis detrimental inflammation panoptosis influenza virus infection	Xu Y; Zheng Y; Liu Y; Wei C; Ren J; Zuo W; Gu R; Liu H; Deng X; Liu Y; Shang X; Ge W; Li Z; Huang Y; He D; Shen X; Wang Z; Lyu C; Wang Z; Mu Y; Zhang Z; Wu H; Li H; Cao B	influenza virus iav induces panoptosis form lytic inflammatory cell death characterized concurrent activation pyroptosis necroptosis apoptosis pathway is recently identified mediator plasma membrane rupture function diversely different type cell death however little is known role panoptosis viral pneumonia here report iav infection triggered increase expression which then oligomerized mediated cell lysis infected macrophage deficiency prevented plasma membrane rupture release damp affecting progression cell death activation single panoptosis pathway wa sufficient to trigger oligomerization robust cell lysis accordingly only when panoptosis pathway were concurrently blocked could oligomerization cell death cell rupture be prevented ablation vivo also alleviated lung injury mortality furthermore revealed association upregulation poor outcome patient collectively finding indicate pivotal role immunopathology iav infection potential bioindicator disease severity prognosis viral pneumonia viral sepsis	Signal Transduct Target Ther	23/09/2025
10.1089/rej.2012.1389	protective effect ginger root extract alzheimer behavioral dysfunction rat	Zeng GF; Zhang ZY; Lu L; Xiao DQ; Zong SH; He JM	aim study wa to assess ability traditional chinese medicinal ginger root extract gre to prevent behavioral dysfunction alzheimer disease ad rat model rat ad model were established operation op which rat were treated injection amyloid aβ continuous gavage aluminum chloride day week gre wa administered to rat day learning memory were assessed rat brain section were processed immunohistochemistry hematoxylin amp amp nissl staining latency to show significant memory deficit wa shorter group that received high dose gre hg group that received low moderate dose gre lg mg lt expression superoxide dismutase sod catalase cat group wa compared to group lt rat group had lower level nuclear malondialdehyde mda expression rat group lt experiment demonstrates administration gre revers behavioral dysfunction prevents symptom rat model	Rejuvenation Res	01/04/2013
10.1038/s41586-025-09541-7	ribonucleotide incorporation mitochondrial dna drive inflammation	Bahat A; Milenkovic D; Cors E; Barnett M; Niftullayev S; Katsalifis A; Schwill M; Kirschner P; MacVicar T; Giavalisco P; Jenninger L; Clausen AR; Paupe V; Prudent J; Larsson NG; Rogg M; Schell C; Muylaert I; Lekholm E; Nolte H; Falkenberg M; Langer T	metabolic dysregulation can lead to inflammatory response imbalanced synthesis trigger release mitochondrial dna mtdna to cytosol innate immune response signalling however how nucleotide deficiency drive inflammation ha not been elucidated here show nucleotide imbalance lead to increased misincorporation ribonucleotides mtdna renal inflammation mouse model lacking mitochondrial exonuclease various tissue aged mouse cell lacking mitochondrial protease similarly reduced deoxyribonucleotide synthesis increase ribonucleotide content mtdna senescent cell lead to mtdna release cytosol activation secretory phenotype sasp which can be suppressed exogenously added deoxyribonucleosides result highlight sensitivity mtdna to aberrant ribonucleotide incorporation show imbalanced nucleotide metabolism lead to inflammatory response sasp senescence	Nature	24/09/2025
