DOI	Title	Authors	Abstract	Section	Date
10.48550/arXiv.2509.19259v1	Moving by Looking: Towards Vision-Driven Avatar Motion Generation	Markos Diomataris; Berat Mert Albaba; Giorgio Becherini; Partha Ghosh; Omid Taheri; Michael J. Black	The way we perceive the world fundamentally shapes how we move, whether it is how we navigate in a room or how we interact with other humans. Current human motion generation methods, neglect this interdependency and use task-specific ``perception'' that differs radically from that of humans. We argue that the generation of human-like avatar behavior requires human-like perception. Consequently, in this work we present CLOPS, the first human avatar that solely uses egocentric vision to perceive its surroundings and navigate. Using vision as the primary driver of motion however, gives rise to a significant challenge for training avatars: existing datasets have either isolated human motion, without the context of a scene, or lack scale. We overcome this challenge by decoupling the learning of low-level motion skills from learning of high-level control that maps visual input to motion. First, we train a motion prior model on a large motion capture dataset. Then, a policy is trained using Q-learning to map egocentric visual inputs to high-level control commands for the motion prior. Our experiments empirically demonstrate that egocentric vision can give rise to human-like motion characteristics in our avatars. For example, the avatars walk such that they avoid obstacles present in their visual field. These findings suggest that equipping avatars with human-like sensors, particularly egocentric vision, holds promise for training avatars that behave like humans.	cs.CV	2025-09-23
10.48550/arXiv.2509.19258v1	Graph-Radiomic Learning (GrRAiL) Descriptor to Characterize Imaging   Heterogeneity in Confounding Tumor Pathologies	Dheerendranath Battalapalli; Apoorva Safai; Maria Jaramillo; Hyemin Um; Gustavo Adalfo Pineda Ortiz; Ulas Bagci; Manmeet Singh Ahluwalia; Marwa Ismail; Pallavi Tiwari	A significant challenge in solid tumors is reliably distinguishing confounding pathologies from malignant neoplasms on routine imaging. While radiomics methods seek surrogate markers of lesion heterogeneity on CT/MRI, many aggregate features across the region of interest (ROI) and miss complex spatial relationships among varying intensity compositions. We present a new Graph-Radiomic Learning (GrRAiL) descriptor for characterizing intralesional heterogeneity (ILH) on clinical MRI scans. GrRAiL (1) identifies clusters of sub-regions using per-voxel radiomic measurements, then (2) computes graph-theoretic metrics to quantify spatial associations among clusters. The resulting weighted graphs encode higher-order spatial relationships within the ROI, aiming to reliably capture ILH and disambiguate confounding pathologies from malignancy. To assess efficacy and clinical feasibility, GrRAiL was evaluated in n=947 subjects spanning three use cases: differentiating tumor recurrence from radiation effects in glioblastoma (GBM; n=106) and brain metastasis (n=233), and stratifying pancreatic intraductal papillary mucinous neoplasms (IPMNs) into no+low vs high risk (n=608). In a multi-institutional setting, GrRAiL consistently outperformed state-of-the-art baselines - Graph Neural Networks (GNNs), textural radiomics, and intensity-graph analysis. In GBM, cross-validation (CV) and test accuracies for recurrence vs pseudo-progression were 89% and 78% with >10% test-accuracy gains over comparators. In brain metastasis, CV and test accuracies for recurrence vs radiation necrosis were 84% and 74% (>13% improvement). For IPMN risk stratification, CV and test accuracies were 84% and 75%, showing >10% improvement.	cs.CV	2025-09-23
10.48550/arXiv.2509.19252v1	Adversarially-Refined VQ-GAN with Dense Motion Tokenization for   Spatio-Temporal Heatmaps	Gabriel Maldonado; Narges Rashvand; Armin Danesh Pazho; Ghazal Alinezhad Noghre; Vinit Katariya; Hamed Tabkhi	Continuous human motion understanding remains a core challenge in computer vision due to its high dimensionality and inherent redundancy. Efficient compression and representation are crucial for analyzing complex motion dynamics. In this work, we introduce an adversarially-refined VQ-GAN framework with dense motion tokenization for compressing spatio-temporal heatmaps while preserving the fine-grained traces of human motion. Our approach combines dense motion tokenization with adversarial refinement, which eliminates reconstruction artifacts like motion smearing and temporal misalignment observed in non-adversarial baselines. Our experiments on the CMU Panoptic dataset provide conclusive evidence of our method's superiority, outperforming the dVAE baseline by 9.31% SSIM and reducing temporal instability by 37.1%. Furthermore, our dense tokenization strategy enables a novel analysis of motion complexity, revealing that 2D motion can be optimally represented with a compact 128-token vocabulary, while 3D motion's complexity demands a much larger 1024-token codebook for faithful reconstruction. These results establish practical deployment feasibility across diverse motion analysis applications. The code base for this work is available at https://github.com/TeCSAR-UNCC/Pose-Quantization.	cs.CV; cs.AI	2025-09-23
10.48550/arXiv.2509.19245v1	ConViS-Bench: Estimating Video Similarity Through Semantic Concepts	Benedetta Liberatori; Alessandro Conti; Lorenzo Vaquero; Yiming Wang; Elisa Ricci; Paolo Rota	What does it mean for two videos to be similar? Videos may appear similar when judged by the actions they depict, yet entirely different if evaluated based on the locations where they were filmed. While humans naturally compare videos by taking different aspects into account, this ability has not been thoroughly studied and presents a challenge for models that often depend on broad global similarity scores. Large Multimodal Models (LMMs) with video understanding capabilities open new opportunities for leveraging natural language in comparative video tasks. We introduce Concept-based Video Similarity estimation (ConViS), a novel task that compares pairs of videos by computing interpretable similarity scores across a predefined set of key semantic concepts. ConViS allows for human-like reasoning about video similarity and enables new applications such as concept-conditioned video retrieval. To support this task, we also introduce ConViS-Bench, a new benchmark comprising carefully annotated video pairs spanning multiple domains. Each pair comes with concept-level similarity scores and textual descriptions of both differences and similarities. Additionally, we benchmark several state-of-the-art models on ConViS, providing insights into their alignment with human judgments. Our results reveal significant performance differences on ConViS, indicating that some concepts present greater challenges for estimating video similarity. We believe that ConViS-Bench will serve as a valuable resource for advancing research in language-driven video understanding.	cs.CV	2025-09-23
10.48550/arXiv.2509.19244v1	Lavida-O: Elastic Masked Diffusion Models for Unified Multimodal   Understanding and Generation	Shufan Li; Jiuxiang Gu; Kangning Liu; Zhe Lin; Zijun Wei; Aditya Grover; Jason Kuen	We proposed Lavida-O, a unified multi-modal Masked Diffusion Model (MDM) capable of image understanding and generation tasks. Unlike existing multimodal diffsion language models such as MMaDa and Muddit which only support simple image-level understanding tasks and low-resolution image generation, Lavida-O exhibits many new capabilities such as object grounding, image-editing, and high-resolution (1024px) image synthesis. It is also the first unified MDM that uses its understanding capabilities to improve image generation and editing results through planning and iterative self-reflection. To allow effective and efficient training and sampling, Lavida-O ntroduces many novel techniques such as Elastic Mixture-of-Transformer architecture, universal text conditioning, and stratified sampling. \ours~achieves state-of-the-art performance on a wide range of benchmarks such as RefCOCO object grounding, GenEval text-to-image generation, and ImgEdit image editing, outperforming existing autoregressive and continuous diffusion models such as Qwen2.5-VL and FluxKontext-dev, while offering considerable speedup at inference.	cs.CV	2025-09-23
10.48550/arXiv.2509.19153v1	LLMs as verification oracles for Solidity	Massimo Bartoletti; Enrico Lipparini; Livio Pompianu	Ensuring the correctness of smart contracts is critical, as even subtle flaws can lead to severe financial losses. While bug detection tools able to spot common vulnerability patterns can serve as a first line of defense, most real-world exploits and losses stem from errors in the contract business logic. Formal verification tools such as SolCMC and the Certora Prover address this challenge, but their impact remains limited by steep learning curves and restricted specification languages. Recent works have begun to explore the use of large language models (LLMs) for security-related tasks such as vulnerability detection and test generation. Yet, a fundamental question remains open: can LLMs serve as verification oracles, capable of reasoning about arbitrary contract-specific properties? In this paper, we provide the first systematic evaluation of GPT-5, a state-of-the-art reasoning LLM, in this role. We benchmark its performance on a large dataset of verification tasks, compare its outputs against those of established formal verification tools, and assess its practical effectiveness in real-world auditing scenarios. Our study combines quantitative metrics with qualitative analysis, and shows that recent reasoning-oriented LLMs can be surprisingly effective as verification oracles, suggesting a new frontier in the convergence of AI and formal methods for secure smart contract development and auditing.	cs.CR; cs.SE	2025-09-23
10.48550/arXiv.2509.19117v1	LLM-based Vulnerability Discovery through the Lens of Code Metrics	Felix Weissberg; Lukas Pirch; Erik Imgrund; Jonas Möller; Thorsten Eisenhofer; Konrad Rieck	Large language models (LLMs) excel in many tasks of software engineering, yet progress in leveraging them for vulnerability discovery has stalled in recent years. To understand this phenomenon, we investigate LLMs through the lens of classic code metrics. Surprisingly, we find that a classifier trained solely on these metrics performs on par with state-of-the-art LLMs for vulnerability discovery. A root-cause analysis reveals a strong correlation and a causal effect between LLMs and code metrics: When the value of a metric is changed, LLM predictions tend to shift by a corresponding magnitude. This dependency suggests that LLMs operate at a similarly shallow level as code metrics, limiting their ability to grasp complex patterns and fully realize their potential in vulnerability discovery. Based on these findings, we derive recommendations on how research should more effectively address this challenge.	cs.CR; cs.LG; cs.SE	2025-09-23
10.48550/arXiv.2509.19101v1	Trigger Where It Hurts: Unveiling Hidden Backdoors through Sensitivity   with Sensitron	Gejian Zhao; Hanzhou Wu; Xinpeng Zhang	Backdoor attacks pose a significant security threat to natural language processing (NLP) systems, but existing methods lack explainable trigger mechanisms and fail to quantitatively model vulnerability patterns. This work pioneers the quantitative connection between explainable artificial intelligence (XAI) and backdoor attacks, introducing Sensitron, a novel modular framework for crafting stealthy and robust backdoor triggers. Sensitron employs a progressive refinement approach where Dynamic Meta-Sensitivity Analysis (DMSA) first identifies potentially vulnerable input tokens, Hierarchical SHAP Estimation (H-SHAP) then provides explainable attribution to precisely pinpoint the most influential tokens, and finally a Plug-and-Rank mechanism that generates contextually appropriate triggers. We establish the first mathematical correlation (Sensitivity Ranking Correlation, SRC=0.83) between explainability scores and empirical attack success, enabling precise targeting of model vulnerabilities. Sensitron achieves 97.8% Attack Success Rate (ASR) (+5.8% over state-of-the-art (SOTA)) with 85.4% ASR at 0.1% poisoning rate, demonstrating robust resistance against multiple SOTA defenses. This work reveals fundamental NLP vulnerabilities and provides new attack vectors through weaponized explainability.	cs.CR	2025-09-23
10.48550/arXiv.2509.18934v1	Generic Adversarial Smart Contract Detection with Semantics and   Uncertainty-Aware LLM	Yating Liu; Xing Su; Hao Wu; Sijin Li; Yuxi Cheng; Fengyuan Xu; Sheng Zhong	Adversarial smart contracts, mostly on EVM-compatible chains like Ethereum and BSC, are deployed as EVM bytecode to exploit vulnerable smart contracts typically for financial gains. Detecting such malicious contracts at the time of deployment is an important proactive strategy preventing loss from victim contracts. It offers a better cost-benefit than detecting vulnerabilities on diverse potential victims. However, existing works are not generic with limited detection types and effectiveness due to imbalanced samples, while the emerging LLM technologies, which show its potentials in generalization, have two key problems impeding its application in this task: hard digestion of compiled-code inputs, especially those with task-specific logic, and hard assessment of LLMs' certainty in their binary answers, i.e., yes-or-no answers. Therefore, we propose a generic adversarial smart contracts detection framework FinDet, which leverages LLMs with two enhancements addressing above two problems. FinDet takes as input only the EVM-bytecode contracts and identifies adversarial ones among them with high balanced accuracy. The first enhancement extracts concise semantic intentions and high-level behavioral logic from the low-level bytecode inputs, unleashing the LLM reasoning capability restricted by the task input. The second enhancement probes and measures the LLM uncertainty to its multi-round answering to the same query, improving the LLM answering robustness for binary classifications required by the task output. Our comprehensive evaluation shows that FinDet achieves a BAC of 0.9223 and a TPR of 0.8950, significantly outperforming existing baselines. It remains robust under challenging conditions including unseen attack patterns, low-data settings, and feature obfuscation. FinDet detects all 5 public and 20+ unreported adversarial contracts in a 10-day real-world test, confirmed manually.	cs.CR	2025-09-23
10.48550/arXiv.2509.18909v1	Obelix: Mitigating Side-Channels Through Dynamic Obfuscation	"Jan Wichelmann; Anja Rabich; Anna P""atschke; Thomas Eisenbarth"	Trusted execution environments (TEEs) offer hardware-assisted means to protect code and data. However, as shown in numerous results over the years, attackers can use side-channels to leak data access patterns and even single-step the code. While the vendors are slowly introducing hardware-based countermeasures for some attacks, others will stay unaddressed. This makes a software-level countermeasure desirable, but current available solutions only address very specific attack vectors or have a narrow leakage model.   In this work, we take a holistic view at the vulnerabilities of TEEs and design a tool named Obelix, which is the first to protect both code and data against a wide range of TEE attacks, from cache attacks over single-stepping to ciphertext side-channels. We analyze the practically achievable precision of state-of-the-art single-stepping tools, and present an algorithm which uses that knowledge to divide a program into uniform code blocks, that are indistinguishable for a strong attacker. By storing these blocks and the program data in oblivious RAM, the attacker cannot follow execution, effectively protecting both secret code and data. We describe how we automate our approach to make it available for developers who are unfamiliar with side-channels. As an obfuscation tool, Obelix comes with a considerable performance overhead, but compensates this with strong security guarantees and easy applicability without requiring any expert knowledge.	cs.CR	2025-09-23
10.48550/arXiv.2509.18886v1	Confidential LLM Inference: Performance and Cost Across CPU and GPU TEEs	Marcin Chrapek; Marcin Copik; Etienne Mettaz; Torsten Hoefler	Large Language Models (LLMs) are increasingly deployed on converged Cloud and High-Performance Computing (HPC) infrastructure. However, as LLMs handle confidential inputs and are fine-tuned on costly, proprietary datasets, their heightened security requirements slow adoption in privacy-sensitive sectors such as healthcare and finance. We investigate methods to address this gap and propose Trusted Execution Environments (TEEs) as a solution for securing end-to-end LLM inference. We validate their practicality by evaluating these compute-intensive workloads entirely within CPU and GPU TEEs. On the CPU side, we conduct an in-depth study running full Llama2 inference pipelines (7B, 13B, 70B) inside Intel's TDX and SGX, accelerated by Advanced Matrix Extensions (AMX). We derive 12 insights, including that across various data types, batch sizes, and input lengths, CPU TEEs impose under 10% throughput and 20% latency overheads, further reduced by AMX. We run LLM inference on NVIDIA H100 Confidential Compute GPUs, contextualizing our CPU findings and observing throughput penalties of 4-8% that diminish as batch and input sizes grow. By comparing performance, cost, and security trade-offs, we show how CPU TEEs can be more cost-effective or secure than their GPU counterparts. To our knowledge, our work is the first to comprehensively demonstrate the performance and practicality of modern TEEs across both CPUs and GPUs for enabling confidential LLMs (cLLMs).	cs.PF; cs.AR; cs.CR; cs.LG	2025-09-23
10.48550/arXiv.2509.18871v1	R-CONV++: Uncovering Privacy Vulnerabilities through Analytical Gradient   Inversion Attacks	Tamer Ahmed Eltaras; Qutaibah Malluhi; Alessandro Savino; Stefano Di Carlo; Adnan Qayyum	Federated learning has emerged as a prominent privacy-preserving technique for leveraging large-scale distributed datasets by sharing gradients instead of raw data. However, recent studies indicate that private training data can still be exposed through gradient inversion attacks. While earlier analytical methods have demonstrated success in reconstructing input data from fully connected layers, their effectiveness significantly diminishes when applied to convolutional layers, high-dimensional inputs, and scenarios involving multiple training examples. This paper extends our previous work \cite{eltaras2024r} and proposes three advanced algorithms to broaden the applicability of gradient inversion attacks. The first algorithm presents a novel data leakage method that efficiently exploits convolutional layer gradients, demonstrating that even with non-fully invertible activation functions, such as ReLU, training samples can be analytically reconstructed directly from gradients without the need to reconstruct intermediate layer outputs. Building on this foundation, the second algorithm extends this analytical approach to support high-dimensional input data, substantially enhancing its utility across complex real-world datasets. The third algorithm introduces an innovative analytical method for reconstructing mini-batches, addressing a critical gap in current research that predominantly focuses on reconstructing only a single training example. Unlike previous studies that focused mainly on the weight constraints of convolutional layers, our approach emphasizes the pivotal role of gradient constraints, revealing that successful attacks can be executed with fewer than 5\% of the constraints previously deemed necessary in certain layers.	cs.CR	2025-09-23
10.48550/arXiv.2509.18800v1	Security Evaluation of Android apps in budget African Mobile Devices	Alioune Diallo; Anta Diop; Abdoul Kader Kabore; Jordan Samhi; Aleksandr Pilgun; Tegawendé F. Bissyande; Jacque Klein	Android's open-source nature facilitates widespread smartphone accessibility, particularly in price-sensitive markets. System and vendor applications that come pre-installed on budget Android devices frequently operate with elevated privileges, yet they receive limited independent examination. To address this gap, we developed a framework that extracts APKs from physical devices and applies static analysis to identify privacy and security issues in embedded software. Our study examined 1,544 APKs collected from seven African smartphones. The analysis revealed that 145 applications (9%) disclose sensitive data, 249 (16%) expose critical components without sufficient safeguards, and many present additional risks: 226 execute privileged or dangerous commands, 79 interact with SMS messages (read, send, or delete), and 33 perform silent installation operations. We also uncovered a vendor-supplied package that appears to transmit device identifiers and location details to an external third party. These results demonstrate that pre-installed applications on widely distributed low-cost devices represent a significant and underexplored threat to user security and privacy.	cs.CR; cs.SE	2025-09-23
10.48550/arXiv.2509.18790v1	Detection of security smells in IaC scripts through semantics-aware code   and language processing	Aicha War; Adnan A. Rawass; Abdoul K. Kabore; Jordan Samhi; Jacques Klein; Tegawende F. Bissyande	Infrastructure as Code (IaC) automates the provisioning and management of IT infrastructure through scripts and tools, streamlining software deployment. Prior studies have shown that IaC scripts often contain recurring security misconfigurations, and several detection and mitigation approaches have been proposed. Most of these rely on static analysis, using statistical code representations or Machine Learning (ML) classifiers to distinguish insecure configurations from safe code.   In this work, we introduce a novel approach that enhances static analysis with semantic understanding by jointly leveraging natural language and code representations. Our method builds on two complementary ML models: CodeBERT, to capture semantics across code and text, and LongFormer, to represent long IaC scripts without losing contextual information. We evaluate our approach on misconfiguration datasets from two widely used IaC tools, Ansible and Puppet. To validate its effectiveness, we conduct two ablation studies (removing code text from the natural language input and truncating scripts to reduce context) and compare against four large language models (LLMs) and prior work. Results show that semantic enrichment substantially improves detection, raising precision and recall from 0.46 and 0.79 to 0.92 and 0.88 on Ansible, and from 0.55 and 0.97 to 0.87 and 0.75 on Puppet, respectively.	cs.CR; cs.AI; cs.LG; cs.SE	2025-09-23
10.48550/arXiv.2509.18761v1	Security smells in infrastructure as code: a taxonomy update beyond the   seven sins	Aicha War; Serge L. B. Nikiema; Jordan Samhi; Jacques Klein; Tegawende F. Bissyande	Infrastructure as Code (IaC) has become essential for modern software management, yet security flaws in IaC scripts can have severe consequences, as exemplified by the recurring exploits of Cloud Web Services. Prior work has recognized the need to build a precise taxonomy of security smells in IaC scripts as a first step towards developing approaches to improve IaC security. This first effort led to the unveiling of seven sins, limited by the focus on a single IaC tool as well as by the extensive, and potentially biased, manual effort that was required. We propose, in our work, to revisit this taxonomy: first, we extend the study of IaC security smells to a more diverse dataset with scripts associated with seven popular IaC tools, including Terraform, Ansible, Chef, Puppet, Pulumi, Saltstack, and Vagrant; second, we bring in some automation for the analysis by relying on an LLM. While we leverage LLMs for initial pattern processing, all taxonomic decisions underwent systematic human validation and reconciliation with established security standards. Our study yields a comprehensive taxonomy of 62 security smell categories, significantly expanding beyond the previously known seven. We demonstrate actionability by implementing new security checking rules within linters for seven popular IaC tools, often achieving 1.00 precision score. Our evolution study of security smells in GitHub projects reveals that these issues persist for extended periods, likely due to inadequate detection and mitigation tools. This work provides IaC practitioners with insights for addressing common security smells and systematically adopting DevSecOps practices to build safer infrastructure code.	cs.CR; cs.AI; cs.LG; cs.SE	2025-09-23
